"company","job-title","level","description","job-url"
"Fellowmind","NewFellows Goes Tech -koulutusohjelma I Haku päättynyt","Entry level","Hakuaika suosittuun NewFellows-koulutusohjelmaan on nyt auki! Tulevan NewFellows Goes Tech -koulutusohjelman kautta etsimme uusia osaajia työskentelemään Fellowmindille ohjelmistokehityksen pariin. Tulemme palkkaamaan koulutusohjelman kautta 15 uutta IT-alan ammattilaista monipuolisiin IT-alan työtehtäviin. Sinun ei tarvitse olla valmis tekijä. Koulutamme sinut tulevaan työtehtävääsi sovelluskehittäjänä.Haluamme kasvattaa sinusta sovelluskehityksen asiantuntijan joko integraatioiden, Microsoft Dynamics 365- tai Power Platform -teknologioiden pariin. Sovelluskehittäjänä Fellowmindilla pääset hyppäämään kiinnostavaan ja monipuoliseen tekniseen rooliin IT-alalle, josta tekeminen ja uuden oppiminen ei lopu!Solmimme heti alusta lähtien kanssasi vakituisen työsopimuksen ja panostamme osaamisesi kehittämiseen. Alan parhaiden kouluttajien ja koulutusten lisäksi saat tukea ja neuvoja kokeneemmilta ohjelmistokehittäjiltä, jotka jakavat sinulle osaamistaan mentorina sekä asiakasprojekteissa että arjessa.NewFellows Goes Tech -ohjelmaan valitut henkilöt palkataan suoraan työsuhteeseen Fellowmindille ja heidän kanssaan solmitaan heti toistaiseksi voimassa oleva työsopimus.Koulutusohjelman alkuvaiheessa painopiste on vahvasti uuden oppimisessa ja koulutuksessa, jonka jälkeen pääset hyödyntämään ja syventämään taitojasi käytännön asiakastyössä. Sinun ei tarvitse olla valmis tekijä, koulutamme sinut tulevaan rooliisi.Oppiminen jatkuu asiakasprojekteissa, joissa pääset syventämään osaamistasi entisestään uusien teknologioiden ja koodauksen parissa - samalla auttaen asiakkaitamme liiketoimintakriittisten ratkaisujen kehittämisessä.Tuleva Roolisi On Aluksi Joku SeuraavistaMeillä pääset kasvamaan monipuoliseksi IT-alan ammattilaiseksi ja tuleva työroolisi muodostuu aikaisemman teknisen osaamisesi, työkokemuksesi sekä kiinnostuksesi mukaan.IntegraatiokehittäjäMicrosoft D365 -sovelluskehittäjäMicrosoft Power Platform -asiantuntija ja -sovelluskehittäjä""Työssä täytyy ratkoa teknisiä asioita, mutta tiimityötaidot ovat yhtä tärkeitä, sillä työtä tehdään asiakkaille.""Miia, integraatiokehittäjäEduksesi Katsomme Osaamisen Esimerkiksi Seuraavista Osa-alueistaToivomme, että olisit päässyt siis jo koodaamisen makuun joko koulutuksen, työn tai harrastuneisuuden kautta.Microsoft Dynamics 365 tai Microsoft Power Platform C# / Java  Microsoft Azure  Web API:t  SQL  Sinun ei tarvitse kuitenkaan olla täysin valmis ohjelmistokehittäjä tai tekninen ammattilainen, sillä meille eniten merkitsee intosi ja motivaatiosi oppia uutta sekä päästä käsiksi uusiin teknologioihin ja asiakkaidemme auttamiseen. Koulutamme sinut tulevaan työtehtävään sekä käytössä oleviin teknologioihin. Työ IT-alalla on jatkuvaa oppimista!Fellowmindilla menestyt, kun työskentelytyylisi on vastuuntuntoinen, asiakaslähtöinen ja haluat kehittyä jatkuvasti omassa työssäsi. Teet töitä ammattitaidolla, mutta sopivan rennolla otteella. Itseohjautuvuuden lisäksi työskentelet sujuvasti myös osana asiakas- tai projektitiimiä, jotta saamme varmistettua asiakkaalle parhaan mahdollisen ratkaisun. Asiakkaidemme ja ympäristömme kansainvälistyessä toivomme sinulta suomen lisäksi myös sujuvaa englannin kielen taitoa.Palkallinen koulutusohjelma ja vakituinen työsuhde: Tarjoamme työn ohella kattavan koulutuksen, jossa kasvat alan ammattilaiseksi! Kehität erittäin arvostettua osaamista Microsoftin Dynamics -, Azure- sekä integraatioympäristöissä niin koulutuksen kuin käytännön työtehtävien kautta.Alan parhaat kouluttajat ja kokeneet kehittäjät mentoreina: Tarjoamme sinulle osaamistasi tukevan lyhyen koulutuskokonaisuuden huippuammattilaistemme johdolla ja saat mahdollisuuden suorittaa alalla arvostettuja sertifiointeja. Kokeneet kehittäjät ovat tukenasi mentoreina.Monipuoliset asiakasprojektit: Pääset myös soveltamaan kykyjäsi ja koulutuksissa opittua oikeissa asiakasprojekteissa heti alussa olevan tiiviimmän koulutusosion jälkeen. Olet mukana rakentamassa kriittisiä liiketoimintaratkaisuja ja todentamaan niiden hyötyjä asiakkaidemme liiketoiminnalle.Kilpailukykyiset työsuhde-edut: Sinulle kuuluu palkan lisäksi myös kilpailukykyiset työsuhde-etumme, joita ovat mm. hierontaetu, kuntosalietu ja ilmaiset ohjatut ryhmäliikuntatunnit sekä paljon jaksamiseen ja virikkeellisyyteen liittyviä Fellowmind-tapahtumia.Koulutamme ja rekrytoimme nyt sinut ja tulevat kollegaasi NewFellows Goes Tech -ohjelman kautta asiakaslähtöisiksi sovelluskehittäjiksi vauhdittamaan kasvuamme niin Helsingissä, Tampereella kuin Vaasassa sekä muilla Fellowmindin toimistoilla Turussa, Lahdessa, Jyväskylässä, Kuopiossa, Oulussa ja Seinäjoella.Hakuaika on päättynyt vuoden 2023 koulutusohjelmaan. Pysy kuulolla tulevista ohjelmistamme somessa sekä verkostoitumalla kanssamme.","https://fi.linkedin.com/jobs/view/newfellows-goes-tech-koulutusohjelma-i-haku-p%C3%A4%C3%A4ttynyt-at-fellowmind-3558739302"
"Canonical","Software-Ingenieur im Außendienst - Deutschland (EMEA)","Entry level","Software-Ingenieur im Außendienst - EMEAbei CanonicalVon Zuhause aus - EMEAUnterstütze globale Unternehmen bei der Einführung der neuesten Private-Cloud-Infrastruktur, Linux und Cloud Native Operations und Open-Source-Anwendungen. Unser Team wendet Expertenwissen auf reale Kundenprobleme an und unterstützt Unternehmen bei der Einführung von Linux Ubuntu, OpenStack, Kubernetes und einer breiten Palette an zugehörigen Technologien.Der Aufgabenbereich dieser Position ist sehr vielfältig. Die Teammitglieder sind Architekten von Linux- und Cloud-Lösungen für unsere Kunden und entwerfen private und öffentliche Cloud-Lösungen, die ihren Workload-Anforderungen entsprechen. Sie sind die Cloud-Consultants, die praktisch mit den Technologien arbeiten, indem sie die Lösung implementieren, testen und am Ende eines Projekts an unser Support- oder Managed-Services-Team übergeben. Sie sind auch Software-Ingenieure, die Python verwenden, um Kubernetes-Operatoren und Infrastructure as Code zu entwickeln.Menschen, die diese Rolle lieben, sind Entwickler, die gerne Kundenprobleme durch Architektur, Präsentationen und Schulungen lösen.Was wirst Du tun:Du arbeitest mit dem gesamten Linux-Stack, vom Kernel über Netzwerke und Speicher bis hin zu AnwendungenIn Python an der Entwicklung und Bereitstellung von Open-Source-Code arbeitenArchitektur von Cloud-Infrastrukturlösungen wie OpenStack, Kubernetes, Ceph, Hadoop und Spark entweder vor Ort entwerfen oder in der öffentlichen Cloud (AWS, Azure, Google Cloud)Coachen und entwickeln Deiner Kollegen dort, wo Du Einblicke hastEntwickle eine gesunde, kollaborative Entwicklungskultur im Einklang mit den UnternehmenswertenArbeite bequem von zu Hause ausWeltweite Reisen zu internen und externen Veranstaltungen (bis zu 25 % der Zeit)Wer bist Du:Abgeschlossenes Studium in Informatik oder verwandtes Fachwissen im Bereich Software EngineeringDu verfügst über fundierte Kenntnisse von Cloud-Computing-Konzepten und -Technologien, wie z. B. Kubernetes, Openstack, AWS, GCP, Azure, Ceph, etc. Du hast praktische Kenntnisse über Linux und NetzwerkeDu verfügst über mittlere bis fortgeschrittene Kenntnisse in der Python-ProgrammierungDu bist eine dynamische Person, die sich gerne in neue Projekte stürzt und mit Menschen interagiertDu bist nachweislich bereit, sich ständig weiterzubildenAusgezeichnete Kommunikations- und Präsentationsfähigkeiten (Englisch und Deutsch)Du bist ein Organisationstalent und hältst Deine Verpflichtungen zuverlässig einWas Du lernen wirst:OpenStack- und Kubernetes-InfrastrukturLinux Ubuntu und Netzwerk-kenntnisseEin breites Spektrum an Open-Source-Anwendungen und -KenntnissenDirekte Zusammenarbeit mit Kunden in verschiedenen Unternehmen Reale und praktische Erfahrung mit einer breiten Palette von neuen Technologien und ToolsWir bieten:Karriere- und WeiterbildungsmaßnahmenDiversity-RessourcengruppenFamilienfreundliche Arbeitszeiten und mobiles ArbeitenAttraktive Vergütung Priority Pass für ReisenHinweis: Die Unternehmenssprache bei Canonical ist Englisch. Es wird ein hohes Maß an Englischkenntnissen erwartet, und das Einstellungsverfahren findet ausschließlich auf Englisch statt. Der für diese Rolle ausgewählte Field Engineer wird auch mit Kunden in deutscher Sprache zusammenarbeiten.Über CanonicalCanonical ist ein wachsendes, internationales Softwareunternehmen, das mit der Open-Source-Community zusammenarbeitet, um Ubuntu - das weltweit führende Cloud-Betriebssystem - bereitzustellen. Unser Ziel ist es, das Potenzial freier Software im Leben von Einzelpersonen und Unternehmen zu nutzen. Unsere Dienstleistungen helfen Unternehmen weltweit, mit Ubuntu Kosten zu senken, die Effizienz zu steigern und die Sicherheit zu erhöhen.Wir sind stolz darauf, einen Arbeitsplatz zu schaffen, der frei von Diskriminierung ist. Die Vielfalt an Erfahrungen, Perspektiven und Hintergründen führt zu einem besseren Umfeld für unsere Mitarbeiter und zu einer besseren Plattform für unsere Nutzer und Kunden. Dies ist etwas, das wir sehr schätzen, und wir ermutigen jeden, ein Teil der Ubuntu-Welt zu werden. Alle qualifizierten Bewerber werden ohne Rücksicht auf Rasse, Hautfarbe, Religion, Geschlecht, Geschlechtsidentität oder -ausdruck, sexuelle Orientierung, nationale Herkunft, Genetik, Behinderung, Alter oder Veteranenstatus bei der Einstellung berücksichtigt.","https://fi.linkedin.com/jobs/view/software-ingenieur-im-au%C3%9Fendienst-deutschland-emea-at-canonical-3731991768"
"Mapbox","Software Development Engineer II, Data Platform","Entry level","Mapbox is the leading real-time location platform for a new generation of location-aware businesses. Mapbox is the only platform that equips organizations with the full set of tools to power the navigation of people, packages, and vehicles everywhere. More than 3.9 million registered developers have chosen Mapbox because of the platform’s flexibility, security, and privacy compliance. Organizations use Mapbox applications, data, SDKs, and APIs to create customized and immersive experiences that delight their customers.What You’ll DoMapbox is looking for an experienced engineer to help grow the foundation of our platform. The Data Platform team owns, maintains and builds crucial services that Mapbox relies upon. We provide reliable and scalable ingestion, processing, warehousing and orchestration solutions.In This Role, You Can Expect ToYou will be responsible for contributing to, operating, and improving all things related to our data platform.Support internal customers of the data platform by building infrastructure and tooling to address their needs Work on our ingestion systems that ingest terabytes of data a day Simplify and strengthen Mapbox’s processes and tools for designing, deploying, and monitoring data processing and querying workloads on AWSContribute to our data processing systems that launch thousands of EMR clusters a day and add to our data lake at petabyte scale Promote a culture of operational excellence by meticulously testing and monitoring our systems and code, and being on-call to support the health of our servicesDesign systems and make decisions that will keep pace with the rapid growth of MapboxDocument your work and decision-making processes, and lead presentations and discussions in a way that is easy for others to understandUphold a culture of collaboration, transparency, creativity, inclusion, and data-driven decisionsWhat We Believe Are Important Traits For This RoleProven ability to design and develop sophisticated, efficient, and durable infrastructure on AWS Experience with our tech stack (Spark, Airflow, Python and/or node.js, Docker, AWS and Snowflake)Experience with Kubernetes is a plus Experience with distributed systems at scaleTrack record of building self-service and high-quality tools for developers with a customer-driven mindsetA desire to share your expertise through documentation, mentorship, and both written and vocal discussionA desire to work with individuals with diverse backgrounds, perspectives, and experiencesAutonomy and proactivity around driving work to completion in the face of ambiguityWhat We ValueIn addition to our core values, which are not unique to this position and are necessary for Mapbox leaders:We value high-performing creative individuals who dig into problems and opportunities.We believe in individuals being their whole selves at work. We commit to this through supportive health care, parental leave, flexibility for the things that come up in life, and innovating on how we think about supporting our people.We emphasize an environment of teaching and learning to equip employees with the tools needed to be successful in their function and the company.We strongly believe in the value of growing a diverse team and encourage people of all backgrounds, genders, ethnicities, abilities, and sexual orientations to apply.By applying for this position, you acknowledge that you agree to the Mapbox Privacy Policy which is linked here.Mapbox is an EEO Employer - Minority/Female/Veteran/Disabled/Sexual Orientation/Gender Identity","https://fi.linkedin.com/jobs/view/software-development-engineer-ii-data-platform-at-mapbox-3610205846"
"Canonical","Ingénieur logiciel de terrain - France (EMEA)","Entry level","Field Software Engineer - FrenchIngénieur logiciel de terrain - EMEACanonicalBasé à domicile - EMEAAidez les entreprises mondiales à adopter les dernières infrastructures de cloud privé, les opérations Linux et cloud native, et les applications open source. Notre équipe apporte des connaissances spécialisées aux problèmes réels des clients, permettant l'adoption de Linux Ubuntu, OpenStack, Kubernetes et d'un large éventail de technologies associées, par les entreprises.Ce rôle comporte de diverses responsabilités. Les membres de l'équipe sont des architectes de solutions Linux et cloud pour nos clients, concevant des solutions d'infrastructures cloud privées et publiques, adaptées à leurs besoins. Ce sont des consultants cloud qui travaillent directement avec nos clients pour déployer les technologies open-source développées par Canonical. Ce sont également des ingénieurs logiciels qui utilisent Python pour développer des opérateurs Kubernetes et améliorer nos outils d'automatisation pour l'infrastructure en tant que service (IaaS).Les personnes qui aiment ce rôle sont des développeurs qui aiment résoudre les problèmes des clients à travers l'architecture, les présentations et la formation.Ce que vous ferez :Travailler sur l'ensemble de l'infrastructure Linux, depuis le système d'exploitation aux applications, en passant par le système réseau et stockage. Travailler avec Python pour développer et publier du code open sourceArchitecturer des solutions d'infrastructure cloud comme OpenStack, Kubernetes, Ceph, Hadoop et Spark sur site ou dans un cloud public (AWS, Azure, Google Cloud). Travailler de près avec vos collègues pour livrer des solutions complexes pour nos clientsDéveloppez une culture d'ingénierie saine et collaborativeTravaillez depuis le confort de votre domicileVoyagez dans le monde entier jusqu'à 25 % du temps pour des événements internes et externesQui êtes-vous ?Vous êtes titulaire d'un diplôme universitaire en informatique ou d'une expertise en ingénierie logicielleVous avez de solides connaissances des concepts et technologies de cloud computing, tels que Kubernetes, Openstack, AWS, GCP, Azure, Ceph, etcVous avez une connaissance pratique de Linux et des réseauxVous avez des compétences en programmation Python de niveau intermédiaire à avancéVous êtes une personne dynamique qui aime se lancer dans de nouveaux projets et interagir avec les gensVous faites preuve d'une volonté d'apprentissage continuVous avez d'excellentes compétences en matière de communication et de présentation (anglais et français)Vous avez d'excellentes capacités d'organisation et de suivi des engagementsCe que vous apprendrezInfrastructure OpenStack et KubernetesLinux Ubuntu et connaissance des réseauxUn large éventail d'applications et de compétences open sourceTravailler directement avec des clients de différents secteurs d'activité Exposition réelle et pratique à un large éventail de technologies et d'outils émergents. Nous offrons :Le remboursement de frais de scolarité liés à l'apprentissage et au développementDes groupes de ressources sur la diversitéTravail à domicileSalaire compétitifRécompenses de reconnaissance par vos collèguesCongés annuelsPriority Pass pour les voyagesRemarque : la principale langue de travail chez Canonical est l'anglais. Un niveau élevé de maîtrise de l'anglais est attendu, et le processus de recrutement se déroule uniquement en anglais. L'ingénieur de terrain sélectionné pour ce rôle travaillera également avec les clients en langue française.À propos de CanonicalCanonical est une entreprise internationale de logiciels en pleine croissance qui travaille avec la communauté des logiciels libres pour fournir Ubuntu, le système d'exploitation cloud le plus répandu au monde. Notre mission est de réaliser le potentiel des logiciels libres dans la vie des individus et des organisations. Nos services aident les entreprises du monde entier à réduire leurs coûts, à améliorer leur efficacité et à renforcer leur sécurité grâce à Ubuntu.Nous sommes fiers de promouvoir un lieu de travail exempt de toute discrimination. La diversité des expériences, des perspectives et des antécédents conduit à un meilleur environnement pour nos employés et à une meilleure plate-forme pour nos utilisateurs et nos clients. C'est quelque chose que nous valorisons profondément et nous encourageons tout le monde à venir faire partie du monde d'Ubuntu. Tous les candidats qualifiés seront pris en considération pour l'emploi sans égard à la race, la couleur, la religion, le sexe, l'identité ou l'expression de genre, l'orientation sexuelle, l'origine nationale, la génétique, le handicap, l'âge ou le statut d'ancien combattant.#stack","https://fi.linkedin.com/jobs/view/ing%C3%A9nieur-logiciel-de-terrain-france-emea-at-canonical-3731988984"
"Canonical","Security Engineer - Ubuntu","Entry level","This is an exciting opportunity to join an industry leading software security team, and help protect the open source community and Ubuntu users from emerging threats. Canonical is building a team to provide security coverage across a wide range of different ecosystems and environments, and work to make the world a better, safer place.As part of the Ubuntu team, you will work with the best and brightest people in technology to monitor, triage, respond to and document new and existing vulnerabilities in open source software. The role will involve collaboration with internal teams and external partners, to identify and prioritize issues and track progress.The role can also include a number of other activities, including security assessment and code review, internal tooling developments, community engagement, security hardening and feature development and industry collaboration participation.This job involves international travel several times a year, usually for one week and requires the ability to be productive in a globally distributed team through self-discipline and self-motivation.What You'll DoAnalyze, fix, and test vulnerabilities in Ubuntu packagesKeep track of vulnerabilities in Ubuntu releases as they are discovered, researched and fixed (using internal software tools)Collaborate with other teams in the Ubuntu community and with upstream developers where appropriate, to exchange or develop vulnerability patches and make sure that Ubuntu includes the very best security featuresAudit source code for vulnerabilitiesWho You AreYou have a thorough understanding of the common categories of security vulnerabilities and techniques for fixing themYou are familiar with coordinated disclosure practicesYou are familiar with open source development tools and methodologiesYou are skilled in one or more of C, Python, go, Rust, Java, Ruby or PHP You have excellent logic, problem-solving, troubleshooting, and decision-making skillsYou can clearly and effectively communicate with the team and Ubuntu community membersWe are proud to foster a workplace free from discrimination. Diversity of experience, perspectives, and background create a better work environment and better products. Whatever your identity we will give your application fair consideration.","https://fi.linkedin.com/jobs/view/security-engineer-ubuntu-at-canonical-3655993650"
"Canonical","Software Engineer - Identity Management for Canonical Products","Entry level","SummaryThis is an exciting opportunity for an experienced software engineer passionate about open source software, Linux, and Web Services at scale. Come build a rewarding, meaningful career working with the best and brightest people in technology at Canonical, a growing international software company.Bring your Python and Golang skills to bear on identity, authorization and access management across Canonical's suite of enterprise products and web services.As a software engineer for Identity Management products of Canonical, you will modernize and expand the capabilities of the identity management solutions we use for authentication and authorization in our products, as well as our canonical.com and ubuntu.com websites. Your work on Identity Management will directly impact the users of all Canonical products.Technical excellence and a background in software engineering are necessary prerequisites for this role. You will be expected to own the design and delivery of the system, facilitate integrations and work with your team on strategy and execution.What you'll doCollaborate proactively with a distributed teamWrite clean web service APIs to support both CLI and web frontend clients, using Python (and optionally Golang). Design and implement new features and enhancements from spec to production and ongoing operations at scale. Review code produced by other engineersDiscuss ideas and collaborate on finding good solutions. Create and enhance management, authentication and authorization API endpointsCraft end-user authentication flows from design to implementationModernize the identity stack of our websites and products by driving adoption of best-of-breed IAM technologies Deliver great products that users love by maintaining a culture of quality and engineering excellenceWork from home with global travel 2 to 4 weeks per year for internal and external eventsWho you areYou have a Bachelor's or equivalent in Computer Science, STEM or similar degreeYou are a software engineer, with specific experience building identity and access management products You are familiar with the open source software, standards, protocols and concepts in the identity space (e.g. OpenID, OAuth, LDAP)You have experience implementing authorization frameworks in distributed systemsYou value secure coding and standards, and enjoy working on teams that do the sameYou have solid experience working in an agile development environmentYou love technology and working with a diverse set of talented people. You are comfortable with Ubuntu as a development and deployment platform. You are curious, flexible, articulate, and accountableYou value soft skills and are passionate, enterprising, thoughtful, and self-motivatedYou love embracing new technologies and pushing the boundaries of what is possible, with a view to building products that improve how people operate software and infrastructure everywhere About CanonicalCanonical is a growing, international software company that works with the open-source community to deliver Ubuntu -- the world's #1 cloud operating system. Our mission is to realise the potential of free software in the lives of individuals and organisations. Our services are helping businesses worldwide to reduce costs, improve efficiency and enhance security with Ubuntu. Canonical is a unique tech company - global, remote-first, open source, with 700 professionals across 50 countries - we want to be the world's best, not biggest, global software company. With almost every team remote by default, Canonical sets the pace on the 21st-century digital workplace.What Canonical offers:Work from homeLearning and development allowancesCompetitive SalaryAnnual compensation reviewRecognition rewardsGenerous annual leavePaid maternity, paternity and sick leavePriority Pass for travelExposure to international business and technologyWe are proud to foster a workplace free from discrimination. Diversity of experience, perspectives, and background create a better work environment and better products. Whatever your identity we will give your application fair consideration.#stack","https://fi.linkedin.com/jobs/view/software-engineer-identity-management-for-canonical-products-at-canonical-3726119800"
