"company","job-title","level","description","job-url"
"Canonical","Software Engineer - Python and K8s","Entry level","Our mission is to reinvent the way companies manage their open source information systems - on public clouds and in their own data centres. To achieve that we are building a new community around Python opscode for open source applications, running on Kubernetes. We want to move all of Canonical and Ubuntu IS onto this new, open source codebase.We are confident that we can dramatically improve the experience of running complex business operations - and then we can help our customers embrace those new techniques and products. Traditionally, IS is an inward-facing operation. We would like to transform our IS team into an extension of the product engineering capability at Canonical. Our internal workloads are in many cases the same open source workloads that our customers want to operate. This team will productise those workloads for real-time automated operations on Kubernetes.This role is ideal for software engineers who enjoy Python, have a passion for distributed systems, and an interest in the entire Linux stack - from kernel to networking to virtualization and containers. It is a role that requires rigour in both code and customer interactions. Our engineers are technically astute open source enthusiasts who are excited about cloud computing and are ready to join a global team charged with delivering world class services to our customers.Strong Python development skills and familiarity with Kubernetes are key requirements of this role. You'll work closely with other teams in Canonical to ensure your products operate reliably, efficiently and scale to production sized workloads for our customers looking to adopt cutting-edge technology. You will participate and be responsible for ensuring sound software architecture and follow best practices in software quality, testing and documentation.What you'll doWork in Python to design and deliver open source software operations codeWork across the entire Linux stack, from kernel, networking, storage, to applicationsLearn to think rigorously about application and infrastructure reliabilityShape high quality open source monitoring and alerting infrastructureSimplify open source operations for our customers and open source communityDemonstrate sound engineering design and testing principles in your codeFollow agile software development practicesCoach and develop your colleagues where you have insightsGrow a healthy, collaborative engineering culture in line with company valuesWork from home with global travel once or twice a year for up to 2 weeks for eventsWho you areYou love technology and working with brilliant peopleYou have a Bachelor's or equivalent in Computer Science, STEM or similar degreeYou are experienced with Linux systems administration, package management, and operationsYou have hands-on experience with at least one public cloudYou are familiar with Docker and KubernetesYou are an experienced Python programmer and enjoy challenging projectsYou understand the importance of reliable software and strive to design and code to that expectationYou are organized and want your team to deliver timely, high quality softwareAbout CanonicalCanonical is a growing international software company that works with the open-source community to deliver Ubuntu, ""the world's best free software platform"". Our mission is to realise the potential of free software in the lives of individuals and organisations. Our services are helping individuals and businesses worldwide to reduce costs, improve efficiency and enhance security with Ubuntu.We are proud to foster a workplace free from discrimination. Diversity of experience, perspectives, and background create a better work environment and better products. Whatever your identity we will give your application fair consideration.#Stack","https://fi.linkedin.com/jobs/view/software-engineer-python-and-k8s-at-canonical-3725451243"
"Nigel Frank International","Software Development Open Application","Entry level","Finnish Speaking Software Development - Open ApplicationAre you a Finnish-speaking Software Developer residing in Finland right now?I am actively working with multiple companies right now seeking a wide range of Software Developers who specialize in the Microsoft Eco-System.No matter your experience we have an opportunity for you, so if you are a Junior, Mid Level, or Senior Developer I would love to have a short discussion with you about what a role would need to look like for it to be interesting to you.Key Skills: .NET Core & C# MSSQL Azure experience (Azure DevOps, Azure Blob Storage, Azure Virtual Machines, Azure Backup, Azure Cosmos DB, Azure Logic Apps, Azure Active Directory, API management & more) Modern JavaScript (React, Angular, Vue) Dynamics 365 AWS TypeScript UI/UX Much more!If you fit any of these criteria or you are curious about other opportunities on the market right now please apply to this advert with your CV attached or reach me directly at r.breeze@nigelfrank.com","https://fi.linkedin.com/jobs/view/software-development-open-application-at-nigel-frank-international-3681592831"
"Jefferson Frank","Scala & Java Fullstack Developer","Entry level","Job DescriptionCustomer service company (Product company) with a large amount of energetic and motivated professionals. You would be working within a positive company culture that encourages individualism, ownership of responsibilities, and of course teamwork. The reason for hiring is their product has a larger demand and they want introduce more developers of all levels with a knowledge of Functional programming and a modern Front end language knowledge.Role & Responsibilities Modern Tech Stacks Micro services Architecture on AWS Solving complex problems with insightful solutionsSkills & Qualifications Scala/Java Typescript, react AWS Git, LinuxBenefits Pension Phone and computer Bonus scheme","https://fi.linkedin.com/jobs/view/scala-java-fullstack-developer-at-jefferson-frank-3665704231"
"Nigel Frank International","Junior/Mid-level Azure Data Engineer","Entry level","The client is a well-establish company that is excelling organically in growth and revenue. They are looking for junior to mid-level Azure Data Engineers with 2+ years of experience to join due to high demand from their clients, as-well as natural expansion of the company.This is a very hands on Data Engineering role. The Candidate will be working heavily with Data Warehousing, ETL, Data Modelling and some reporting.Skills & Qualifications Relevant work experience/certifications/education Azure Stack, ETL Pipeline, Data Warehousing experience, Python, C#, Power BI Fluency in Finnish is a requirement for this roleBenefits Opportunity to become a shareholder in the company Training and paid certifications Occupational health-care Massages, wellness, food vouchers, travel vouchers Very welcoming and supportive environment where everyone wants you to succeed and progress, you will feel very valued here.To learn more, send an updated CV to d.field@nigelfrank.com. Even if this role isn't an exact match, get in touch to discuss your interests.Nigel Frank International is the global leader in Microsoft Technology Recruitment. Since 2006, we've found over 20,000 permanent and contract Microsoft professionals for partners, ISVs, and end users in the ecosystem.","https://fi.linkedin.com/jobs/view/junior-mid-level-azure-data-engineer-at-nigel-frank-international-3730122935"
"Miili Consulting","SENIOR JAVA DEVAAJAKSI MIILILLE!","Entry level","TULE HYVÄN MIELEN TYÖPAIKKAAN!Etsimme uudeksi miililäiseksi kokenutta SENIOR JAVA DEVAAJAA. Etsitkö työpaikkaa, jossa hyvinvointiisi panostetaan?Työssäsi pääset osaksi kasvavaa ja kehittyvää tiimiämme, jonka tekemistä kulttuurimme ja vahvat työntekijälähtöiset arvomme ajavat. Meillä saat äänesi kuuluviin ja kehityksesi pilviin!KEITÄ OLEMME?Miili on vuonna 2018 perustettu tiivis, mutta kasvava it-konsultointiyritys. Miili syntyi halusta luoda IT-osaajille työpaikka, jossa työntekijöiden hyvinvointi ja kehittyminen ovat keskiössä.Miilillä on Hyvän mielen työpaikka®-merkki tunnustuksena tekemästämme työstä mielenterveyden ja hyvinvoinnin edistämiseksi sekä pyrkimyksestämme kehittää organisaatiotamme vieläkin mieliystävällisemmäksi. Blogistamme pääset lukemaan lisää, miten nämä asiat on huomioitu konkreettisesti arjessamme.Asiakaskuntamme on laaja ja projektien toimiala vaihtelee, mikä tarjoaa paljon mielenkiintoisia tehtäviä ja uusia haasteita.MITÄ TOIVOMME SINUN OSAAVAN:Toivomme, että sinulla olisi tietoa ja näyttöä useammasta seuraavien teknologioiden osaamisesta ja useamman vuoden kokemus:✔️ Java✔️ Kotlin✔️ Scala✔️ Spring framework / Spring Boot✔️ Javalin✔️ Testiautomaatio✔️ Relaatiotietokannat✔️ No-SQL ‑tietokannat✔️ Hajautetut järjestelmät✔️ Pilvijärjestelmien (AWS, Azure, GCP) tuntemista✔️ CI/CD, Docker, GitMITÄ TARJOAMME:💚 Kiinnostavat ja vaihtelevat projektit eri toimialoilta💚 Mahdollisuus vaikuttaa ja saada äänesi kuuluviin💚 Erinomaiset kehittymismahdollisuudet, sertifiointeja ja kehittymissuunnitelma💚 Saat käyttää 15 tuntia työajastasi kuukaudessa opiskeluun💚 Vähintään 3 viikon lomat kesken vuotta tulevalle💚 Pyöräetu💚 Lounasetu, joka tulee palkan päälle💚 Liikunta- ja kulttuurietu 400 euroa vuodessa💚 Hierontaetu 360 euroa vuodessa💚 Liikuntaa voit harrastaa viikossa tunnin verran työajastasi💚 Kattava työterveyshuolto:leikkaushoidotpsykoterapiaunivalmennusravintoterapeuttihammaslääkäri 500 €/v + tarkastus💚 Syntymäpäiväsi vapaaksi💚 Vapaa-ajan vakuutukset💚 Matkapuhelinetu💚 Itse valitsemasi työvälineet💚 Mahdollisuus joustavaan työskentelyyn💚 Pienen talon kyvykkyys huomioida sinut yksilönäJÄTÄ YHTEYSTIETOSI, NIIN OTAMME YHTEYTTÄ!Hakemuksen jättäminen meille käy minuutissa! Jätä vähintään yhteystietosi ja mielellään lyhyt esittely itsestäsi, CV ei ole pakollinen.Voit hakea myös pelkästään Linkkari profiilillasi! Se käy nopeasti!Jos profiilisi vaikuttaa lupaavalta, niin sovimme kanssasi rennon juttuhetken! :)","https://fi.linkedin.com/jobs/view/senior-java-devaajaksi-miilille%21-at-miili-consulting-3664570354"
"Canonical","Software Engineer - Data Infrastructure","Entry level","Canonical is building a comprehensive automation suite to provide multi-cloud and on-premise data solutions for the enterprise. The data platform team is a collaborative team that develops a full range of data stores and data technologies, spanning from big data, through NoSQL, cache-layer capabilities, and analytics; all the way to structured SQL engines.We are facing the interesting problem of fault-tolerant mission-critical distributed systems and intend to deliver the world's best automation solution for delivering data platforms.We have a number of openings ranging anywhere from junior to senior level. We will help you identify a suitable position depending on your experience and interests. Engineers who thrive at Canonical are mindful of open-source community dynamics and equally aware of the needs of large, innovative organisations.Location: This is a Globally remote roleWhat your day will look likeThe data platform team is responsible for the automation of data platform operations. This includes ensuring fault-tolerant replication, TLS, installation, and much more; but also provides domain-specific expertise on the actual data system to other teams within Canonical. This role is focused on the creation and automation of features of data platforms, not analysing the data in them.Collaborate proactively with a distributed teamWrite high-quality, idiomatic Python code to create new featuresDebug issues and interact with upstream communities publiclyWork with helpful and talented engineers including experts in many fieldsDiscuss ideas and collaborate on finding good solutionsWork from home with global travel for 2 to 4 weeks per year for internal and external eventsWhat we are looking for in youProven hands-on experience in software development using PythonProven hands-on experience in distributed systems Have a Bachelor's or equivalent in Computer Science, STEM, or a similar degreeWillingness to travel up to 4 times a year for internal eventsAdditional Skills That You Might Also BringYou might also bring a subset of experience from the following, which will determine the exact role and level we consider you for:Experience operating and managing data platform technologies like PostgreSQL, MySQL, MongoDB, OpenSearch, Kafka, Yugabyte, Trino, Superset, Atlas, Ranger, and RedisExperience with Linux systems administration, package management, and operationsExperience with the public cloud or a private cloud solution like OpenStackExperience with operating Kubernetes clusters and a belief that it can be used for serious persistent data servicesWhat we offer youYour base pay will depend on various factors including your geographical location, level of experience, knowledge and skills. In addition to the benefits above, certain roles are also eligible for additional benefits and rewards including annual bonuses and sales incentives based on revenue or utilisation. Our compensation philosophy is to ensure equity right across our global workforce.In addition to a competitive base pay, we provide all team members with additional benefits, which reflect our values and ideals. Please note that additional benefits may apply depending on the work location and, for more information on these, please ask your Talent Partner.Fully remote working environment - we've been working remotely since 2004!Personal learning and development budget of 2,000USD per annumAnnual compensation reviewRecognition rewardsAnnual holiday leaveParental LeaveEmployee Assistance ProgrammeOpportunity to travel to new locations to meet colleagues at 'sprints'Priority Pass for travel and travel upgrades for long haul company eventsAbout CanonicalCanonical is a pioneering tech firm that is at the forefront of the global move to open source. As the company that publishes Ubuntu, one of the most important open source projects and the platform for AI, IoT and the cloud, we are changing the world on a daily basis. We recruit on a global basis and set a very high standard for people joining the company. We expect excellence - in order to succeed, we need to be the best at what we do.Canonical has been a remote-first company since its inception in 2004. Work at Canonical is a step into the future, and will challenge you to think differently, work smarter, learn new skills, and raise your game. Canonical provides a unique window into the world of 21st-century digital business.Canonical is an equal-opportunity employerWe are proud to foster a workplace free from discrimination. Diversity of experience, perspectives, and background create a better work environment and better products. Whatever your identity, we will give your application fair consideration.","https://fi.linkedin.com/jobs/view/software-engineer-data-infrastructure-at-canonical-3641759169"
"Jefferson Frank","AWS Data Engineer - Helsinki","Entry level","Job Title: AWS Data EngineerLocation: Helsinki, FinlandAbout Us: Our client is a leading product company headquartered in Helsinki, Finland, specializing in Identity and Access Management (IaM), cybersecurity, and Single Sign-On (SSO) solutions. They are committed to helping organizations enhance their security posture and streamline access management for their users. Their innovative products are trusted by businesses worldwide to protect their digital assets.Position Overview: We are seeking a skilled AWS Data Engineer to join their dynamic team in Helsinki. As an AWS Data Engineer, you will play a pivotal role in designing, developing, and maintaining their data infrastructure. Your work will be instrumental in ensuring that their IaM, cybersecurity, and SSO products continue to provide state-of-the-art security solutions for their customers.Key Responsibilities Design, build, and maintain scalable data pipelines and architectures on AWS. Develop data models and ETL processes to support business intelligence, analytics, and reporting. Collaborate with cross-functional teams to gather requirements and ensure data infrastructure meets business needs. Monitor and optimize data performance and reliability. Implement data security and compliance best practices. Work with data warehousing technologies and tools, such as Redshift, S3, and Glue. Collaborate with Data Scientists and Analysts to provide timely access to quality data. Stay up-to-date with industry trends and emerging AWS technologies to enhance our data capabilities.Qualifications Bachelor's or Master's degree in Computer Science, Data Engineering, or a related field. 3+ years of professional experience as a Data Engineer with a focus on AWS. Strong proficiency with AWS services, including S3, Redshift, Glue, and Lambda. Proficiency in Python, SQL, and data modeling. Experience with data warehousing and ETL processes. Familiarity with data security and compliance standards. Excellent problem-solving and communication skills. Finnish language skills are preferred. AWS certifications (e.g., AWS Certified Data Analytics, AWS Certified Data Engineer) are a plus.If you are a passionate AWS Data Engineer looking to make an impact in the field of cybersecurity and data analytics, we would love to hear from you.To apply, please send your resume and a cover letter detailing your relevant experience to s.cook1@jeffersonfrank.com.Please note, only applicants that are successful, located in Helsinki, and that have been selected for an initial screening will be contacted.","https://fi.linkedin.com/jobs/view/aws-data-engineer-helsinki-at-jefferson-frank-3726877948"
"Jefferson Frank","DevOps Engineer","Entry level","You Would Improve, Measure And Monitor AWS Deployments, From Dev To Production Using a Range Of Modern ToolsI'm working with a Security focused Finnish Software Company who are looking to hire a skilled hands-on Engineer to develop deployment automation for infrastructure and applications running on AWS. Java, TypeScript, Terraform, PostgreSQL, IAM, Linux, CI/CD, IaC, AWS.The CTO himself said the following about the company: ""When I joined he knew there was a lot of legacy and mopping up. In all honesty, it was not that pleasant. Now the engineering team is fixed, they have doubled in size and hired competent engineers making them highly efficient. The game has changed and the overall quality is very high. New product line with a SaaS line in which the Domain is very interesting and offers meaningful work. There is nothing on the market that does/has some of the selling points that they have.The CTO is currently on vacation but we have interview availability from 07.08 and I'd like to speak with you before then if possible.Some Of The Perks Include Open environment where innovation, learning and actions are encouraged Telecommuting opportunities (Work from home if you wish) Close knit team of intelligent colleagues working to solve complex problems together Competitive salary with additional benefits and stock options Freedom to choose your tools (Mac, Linux, Windows, or any other that works for you) Mature Software company (15 years old) which has retained it's start-up styled culture (very agile) despite having nearly 100 employees across 3 countriesMy client is looking to begin the interview process immediately so feel free to apply now!This is a brief description of the role, for the full information, simply apply to the role and I will call you to discuss.Twitter: @_JeffersonFrankLinkedIn: https://www.linkedin.com/in/jason-upton-167479231/Email: j.upton@jeffersonfrank.comPhone: +358 75 3266673Please Note: This is a permanent role. This role does not offer Sponsorship. You must have the right to work in Finland with no restrictions. Some of our roles may be subject to successful background/security checks.If this wasn't exactly the role you were looking for, please apply to this role anyway, just highlight what you are looking for, apply with your CV with a brief overview of what you are looking for (The role, top 3 techs, location, salary).I will call you to discuss your skill-set further, there may be other roles I am working on that you may be suited for.I specialise in Mobile, Web and Cloud (AWS) recruitment here at Jefferson Frank International, focusing on the placement of highly-skilled candidates in various IT positions (Engineers, Analysts, Architects, Consultants, Project Managers, Management etc.).We are the only global recruitment agency dedicated solely to AWS technology. Jefferson Frank is the AWS recruitment agency of choice. Whether it's a contract, permanent or remote position, we find great people great jobs.","https://fi.linkedin.com/jobs/view/devops-engineer-at-jefferson-frank-3698028073"
"Canonical","Software Engineer - OpenStack","Entry level","This is an exciting opportunity for a software engineer passionate about open source software, Linux, and OpenStack. Come build a rewarding, meaningful career working with the best and brightest people in technology at Canonical, a growing international software company.As a software engineer on the OpenStack Engineering team, you'll be building Charmed OpenStack and Ceph, a suite of open source Python based charms for deploying and managing OpenStack and Ceph. Your work will bring cloud platform technologies to a wide range of users and computing environments, from desktops to bare metal servers. This role requires a python software developer with a passion for automating infrastructure as code.Applicants should be passionate about the future of the software defined datacenter, distributed systems, and open source. Canonical is a globally distributed team of engineers who share that passion, and you will need to work well in that context. Engineers who thrive at Canonical are mindful of the dynamics of the open source ecosystem, and equally aware of the needs of large, innovative organizations.This job involves international travel several times a year, usually for one week at a time.What You'll DoCollaborate proactively with a distributed teamWrite high quality code to create new featuresDebug issues and produce high quality code to fix themReview code produced by other engineersDiscuss ideas and collaborate on finding good solutionsEnsure the success of OpenStack and Ceph on multiple architecturesWork from home with global travel 2 to 4 weeks for internal and external eventsWho You AreYou love technology and working with brilliant peopleYou are curious, flexible, articulate, and accountableYou value soft skills and are passionate, enterprising, thoughtful, and self-motivatedYou have a Bachelor's or equivalent in Computer Science, STEM or similar degreeYou have experience with PythonYou have interest and experience with two or more of the following:Ubuntu Linux - kernel or userspace, Kubernetes, OpenStack, Ceph, AI/ML, QEMU/KVM, LXC/LXD, Python, Go, C, Postgresql, Mongo, Debian packaging, scalable web servicesYou have experience with non-x86 architectures, including s390, arm64, power and othersYou have experience with OpenStack, OVN, Openvswitch and other related cloud technologiesWe are proud to foster a workplace free from discrimination. We truly believe that diversity of experience, perspectives, and background will lead to a better environment for our employees and a better platform for our users and customers. This is something we value deeply and we encourage everyone to come be a part of the world of Ubuntu.Keywords: python, agile, lean, distributed systems, openstack, ceph, containers, kubernetes, docker, scale-out, orchestration, linux, ubuntu, cloud, devops, open source, serverless, networking, home, remote job, software development, software engineering, openstackReports to: OpenStack Product Engineering ManagerJob location: Remote, home-based, Americas","https://fi.linkedin.com/jobs/view/software-engineer-openstack-at-canonical-3726119665"
