"company","job-title","level","description","job-url"
"Jefferson Frank","Backend Engineer - Helsinki - Hybrid - Product Company","Entry level","Must be located in FinlandJob DescriptionThe role itself has a 3-stage process. This opportunity is in a product company. You would be helping them to build smart solutions while using modern technologies such as typescript, serverless, docker, terraform. All of this would be done on top of the services that AWS offers. As the organisation and the product is growing there are plenty of possibilities to grow yourself within the company.Role & Responsibilities Practical experience building solutions on top of AWS infrastructure Mainly building with Typescript their Product - building new map features, IoT, Push Notifications Someone that has built or wants to be challenged of building reliable, maintanable and scalable solutions.Skills & Qualifications Typescript Node.js Lambda | MongoDB | Serverless AWS (Not mandatory - preference)Beneficial To Have Python GoLang GraphQLThis is a brief description of the role, for the full information, simply apply to the role and I will call you to discuss.Twitter: @_JeffersonFrankLinkedIn: https://www.linkedin.com/in/rokas-brancevicius-334697195/Email: r.brancevicius@jeffersonfrank.comPhone: +358 75 3263950Please Note: This is a permanent role. This role is for Finnish residents only. This role does not offer Sponsorship. You must have the right to work in Finland with no restrictions. Some of our roles may be subject to successful background/security checks.If this wasn't exactly the role you were looking for, please apply to this role anyway, just highlight what you are looking for, apply with your CV with a brief overview of what you are looking for (The role, top 3 techs, location, salary).I will call you to discuss your skill-set further, there may be other roles I am working on that you may be suited for.","https://fi.linkedin.com/jobs/view/backend-engineer-helsinki-hybrid-product-company-at-jefferson-frank-3677207936"
"Target Vision Oy - Executive Search & Recruitment Tailor Made Solutions in Finland and International","SW Developer","Entry level","We are looking for a Machine Learning SW expert to improve our deployment from Python to mobile runtime stream. This work focuses on exporting the developed ML models from Python development environment to our mobile runtime environment (C++). There are two main areas of focus, model export to mobile format and then mobile ML model execution on device. This requires compilation and integration into our software product’s runtime environment.The work includes evaluation of ARM NN SDK (C++) features regarding Onnx and TFLite support and limitations as well as performance evaluation on converted models. A study on the workload for runtime conversion of PyTorch in Android AOSP environment is needed. Also, the work effort required for maintenance (version updates) and dependency identification is part of this work. An important part of the work consists of integrating ARM NN SDK into our existing C++ implemented solution. This includes changes required to make our SW product’s SDK API and its compilation and testing with our ML models suitable. The goal is to ensure modest workload for version updates with automation of testing and compilation, especially in Android Open Source Project (AOSP) project.The most important part of the work is PyTorch -> mobile conversion and runtime environment design and implementation. The current implementation flow from TensorFlow to TFLite model in TFLite runtime is to be changed to a flow from PyTorch to mobile optimized model. This work includes selection of suitable format at Python level (e.g. Onnx, TFLite, PyTorch mobile optimized) as well as evaluation and creation of conversion path from PyTorch to target format. There are several options, each with different constraints related to e.g. quality or predictable execution speed. Also, model optimization, such as quantization, is needed as part of the conversion flow. Compilation and integration against our SW product’s SDK API and testing with our ML models is to be done to verify the conversion.The recommended locations are Tampere or Espoo. The assumption is that most of the work can be done remotely, but network access requires a laptop managed by the client. We will provide the devices required for the work.We estimate that a skilled expert could complete this work by the end of 2023, if the start would be in August.After successful completion of this project, there may be new needs for a possible follow-up project.Skills and qualifications required Strong practical experience in Maching Learning development workflow Deep understanding of Onnx, TFLite and PyTorch ML development environments Good understanding of common DNN models model architecture and their parameters in each target ML development environment Excellent C++ SW development skills Understanding of Android AOSP Build engineering skills (CMake, Soong/Bazel for AOSP) Experience with ARM NN SDK Experience in implementing and testing ML-based solutions on ARM with Android OS and HW device Very good general software development skills with experience in using GitLab/GitHub and CI/CD","https://fi.linkedin.com/jobs/view/sw-developer-at-target-vision-oy-executive-search-recruitment-tailor-made-solutions-in-finland-and-international-3699967326"
"Jefferson Frank","Backend Engineer - Helsinki - Hybrid - Product Company","Entry level","Must be located in FinlandJob DescriptionThe role itself has a 3-stage process. This opportunity is in a product company. You would be helping them to build smart solutions while using modern technologies such as typescript, serverless, docker, terraform. All of this would be done on top of the services that AWS offers. As the organisation and the product is growing there are plenty of possibilities to grow yourself within the company.Role & Responsibilities Practical experience building solutions on top of AWS infrastructure Mainly building with Typescript their Product - building new map features, IoT, Push Notifications Someone that has built or wants to be challenged of building reliable, maintanable and scalable solutions.Skills & Qualifications Typescript Node.js Lambda | MongoDB | Serverless AWS (Not mandatory - preference)Beneficial To Have Python GoLang GraphQLThis is a brief description of the role, for the full information, simply apply to the role and I will call you to discuss.Twitter: @_JeffersonFrankLinkedIn: https://www.linkedin.com/in/rokas-brancevicius-334697195/Email: r.brancevicius@jeffersonfrank.comPhone: +358 75 3263950Please Note: This is a permanent role. This role is for Finnish residents only. This role does not offer Sponsorship. You must have the right to work in Finland with no restrictions. Some of our roles may be subject to successful background/security checks.If this wasn't exactly the role you were looking for, please apply to this role anyway, just highlight what you are looking for, apply with your CV with a brief overview of what you are looking for (The role, top 3 techs, location, salary).I will call you to discuss your skill-set further, there may be other roles I am working on that you may be suited for.","https://fi.linkedin.com/jobs/view/backend-engineer-helsinki-hybrid-product-company-at-jefferson-frank-3727377051"
"Jefferson Frank","Backend Engineer - Helsinki - Hybrid - Product Company","Entry level","Must be located in FinlandJob DescriptionThe role itself has a 3-stage process. This opportunity is in a product company. You would be helping them to build smart solutions while using modern technologies such as typescript, serverless, docker, terraform. All of this would be done on top of the services that AWS offers. As the organisation and the product is growing there are plenty of possibilities to grow yourself within the company.Role & Responsibilities Practical experience building solutions on top of AWS infrastructure Mainly building with Typescript their Product - building new map features, IoT, Push Notifications Someone that has built or wants to be challenged of building reliable, maintanable and scalable solutions.Skills & Qualifications Typescript Node.js Lambda | MongoDB | Serverless AWS (Not mandatory - preference)Beneficial To Have Python GoLang GraphQLThis is a brief description of the role, for the full information, simply apply to the role and I will call you to discuss.Twitter: @_JeffersonFrankLinkedIn: https://www.linkedin.com/in/rokas-brancevicius-334697195/Email: r.brancevicius@jeffersonfrank.comPhone: +358 75 3263950Please Note: This is a permanent role. This role is for Finnish residents only. This role does not offer Sponsorship. You must have the right to work in Finland with no restrictions. Some of our roles may be subject to successful background/security checks.If this wasn't exactly the role you were looking for, please apply to this role anyway, just highlight what you are looking for, apply with your CV with a brief overview of what you are looking for (The role, top 3 techs, location, salary).I will call you to discuss your skill-set further, there may be other roles I am working on that you may be suited for.","https://fi.linkedin.com/jobs/view/backend-engineer-helsinki-hybrid-product-company-at-jefferson-frank-3711797845"
"Canonical","Software Engineer - Python - Ubuntu Pro client - graduate level","Entry level","Ubuntu Pro is a suite of specialist services provided by Canonical. Whether for enterprise customers deploying systems at scale or users who want security patching for their personal Ubuntu LTS at home, the Ubuntu Pro Client is the command-line tool that manages all these services.The quality and stability of the Ubuntu Pro Client is critically important, since it comes pre-installed on every Ubuntu system. You'll work with the Ubuntu Server team, alongside major cloud partners and multiple Canonical product teams to develop, test and release improvements to the Pro client. You will also be a voice in communication with our users, ensuring their needs are met.This role requires quality-oriented software engineering in Python and a focus on software interoperability over a vast range of target releases and environments. Excellent Python skills are a key requirement, with previous contributions to open source Python projects being an advantage. The Pro client often interacts with the Ubuntu package management; therefore, experience in configuring apt, and knowledge of deb packaging and general system administration is advantageous in this role.Applicants should be passionate about the Ubuntu project and its values and about building tools that are used by millions of people around the world. A personal interest and emphasis on quality, thinking of edge cases, ease of use, documentation, and careful community coordination is important. The Pro client is used at all ranges, from mission-critical environments to hobbyist Ubuntu users; applicants should be ready to work with the whole spectrum of end users and help guide engineering best practices with all of them in mind.What you'll doCollaborate proactively with a distributed teamWrite high quality code, with unit and functional tests, to create new featuresDebug issues and produce high quality code to fix themReview code produced by other engineersDiscuss ideas and investigate to find good solutionsWork from home, with global travel 2 to 4 weeks per year for internal and external eventsWho you areYou love technology and working with brilliant peopleYou are curious, flexible, articulate, and accountableYou value soft skills and are passionate, enterprising, thoughtful, and self-motivatedYou have a Bachelor's or equivalent in Computer Science, STEM or similar degreeYou have extensive experience with Python on LinuxYou have interest in and experience with two or more of the following: Ubuntu Linux systems administration, continuous integration, end-system contract management, Debian packaging, working with public or on premise cloudsBonus points if you have experience engaging with the open source communityCanonical is proud to foster a workplace free from discrimination. Diversity of experience, perspectives, and background lead to a better environment for our employees and a better platform for our users and customers. This is something we value deeply and we encourage everyone to come be a part of the world of Ubuntu.#stack","https://fi.linkedin.com/jobs/view/software-engineer-python-ubuntu-pro-client-graduate-level-at-canonical-3671496125"
"Canonical","Graduate Linux System Engineer - QA, Tooling, Automation","Entry level","We are seeking a software engineer passionate about software quality, Ubuntu, and the open source community, to join the Ubuntu Quality Engineering team as we expand the set of open source packages we fully support and secure.We see quality engineering as a first class engineering practice and are looking for people who can bring deep engineering insights to automation, testing capabilities, reporting and data analytics, as well as run processes in partnership with Canonical and community teams.Ubuntu strives to deliver the latest-best free software components, in an easy to use and highly reliable form. We build on the technical excellence of Debian and bring additional focus and shape to the solutions we offer the industry.As an Ubuntu Quality Engineer, you must be passionate about the future of Ubuntu, about quality and continuous integration and testing. You will work closely with multiple teams at the heart of Ubuntu and drive quality excellence. You will work closely with the Ubuntu Desktop, Server and Foundations team and put in place metrics for quality. You will research existing issues, troubleshoot and resolve problems, and identify opportunities for improvement and communicate them to the rest of the organization to drive the overall quality of Ubuntu. This is a great opportunity to start and progress your career in the QA domain.Location: This is a Globally remote roleWhat your day will look likeMonitor indicators of quality across the Ubuntu ecosystem and productsTroubleshoot and resolve issues in Ubuntu Desktop, Ubuntu Server and Ubuntu CoreEnhance our continuous integration to guard Ubuntu image, release and package qualityReport on KPIs and analytical insightsEmpower other teams for better planning and constant quality improvementsDevelop, enhance and automate test cases, from unit tests to end-to-end multi machine workloadsWork from home with international travel twice a year, for events up to two weeks longWhat we are looking for in youA strong software engineering, Linux, and open source backgroundIn-depth knowledge of Python and Shell scriptingExperience with C/C++Excellent troubleshooting skills and experience working with others to identify, isolate and resolve issuesExperience with quality processes and continuous integration toolsExperience working in an agile development environmentAdditional Skills That You Might Also BringExperience with Debian/Ubuntu based operating system and good understanding of Debian packaging and snaps would also be a considerable advantage.What we offer youWe consider geographical location, experience, and performance in shaping compensation worldwide. We revisit compensation annually (and more often for graduates and associates) to ensure we recognise outstanding performance. In addition to base pay, we offer a performance-driven annual bonus. We provide all team members with additional benefits, which reflect our values and ideals. We balance our programs to meet local needs and ensure fairness globally.Distributed work environment with twice-yearly team sprints in person - we've been working remotely since 2004!Personal learning and development budget of USD 2,000 per yearAnnual compensation reviewRecognition rewardsAnnual holiday leaveMaternity and paternity leaveEmployee Assistance ProgrammeOpportunity to travel to new locations to meet colleagues from your team and othersPriority Pass for travel and travel upgrades for long haul company eventsAbout CanonicalCanonical is a pioneering tech firm that is at the forefront of the global move to open source. As the company that publishes Ubuntu, one of the most important open source projects and the platform for AI, IoT and the cloud, we are changing the world on a daily basis. We recruit on a global basis and set a very high standard for people joining the company. We expect excellence - in order to succeed, we need to be the best at what we do.Canonical has been a remote-first company since its inception in 2004. Work at Canonical is a step into the future, and will challenge you to think differently, work smarter, learn new skills, and raise your game. Canonical provides a unique window into the world of 21st-century digital business.Canonical is an equal opportunity employerWe are proud to foster a workplace free from discrimination. Diversity of experience, perspectives, and background create a better work environment and better products. Whatever your identity, we will give your application fair consideration.","https://fi.linkedin.com/jobs/view/graduate-linux-system-engineer-qa-tooling-automation-at-canonical-3689050651"
"Nigel Frank International","Full Stack Developer","Entry level","Full Stack Developer (.NET/C#) - Permanent Hire - Product DevelopmentMy client is a leading provider of digital solutions dedicated to making cities smarter, more sustainable, and benefiting the well-being of Finnish people and nature. They combine cutting-edge technology, innovative thinking, and a passion for creating positive change to develop solutions that address the challenges faced by urban environments. As a rapidly growing company, they offer a dynamic and collaborative work environment where talented professionals can thrive and make a real impact!Currently they are seeking for an experienced Full Stack Developer to join our team!In this role, you will be responsible for designing, developing, and maintaining their digital solutions, actively driving innovation and contributing to the transformation of urban environments in Finland.Responsibilities: Develop and maintain scalable, secure, and efficient web applications. Collaborate with cross-functional teams to design and implement innovative solutions that address complex business requirements. Participate in the entire software development life cycle, including planning, design, coding, testing, and deployment. Write clean, maintainable, and well-documented code that adheres to industry best practices and coding standards.Required experience: Finnish language fluency required. Proven experience (at least 3 years) as a Full Stack Developer, with a strong focus on .NET/C# and modern JavaScript frameworks (e.g., React, Angular, or Vue.js). Experience with relational databases (e.g., SQL Server) and database design principles. Strong communication and collaboration skills, with the ability to work effectively in a team environment.What They Can Offer You: Collaborative and inclusive work environment that values diversity and encourages new ideas. Opportunity to work on impactful projects that contribute to the well-being of Finnish people and nature. Offering remote or hybrid working model across multiple cities in Finland. Earning potential of up to 5,000€ per month + multiple benefits including health-care insurance, lunches, phone and more. Personal growth and development opportunities throughout your journey at the company.Any further questions before applying?Email: e.tsvang@nigelfrank.comCall: +358942452344","https://fi.linkedin.com/jobs/view/full-stack-developer-at-nigel-frank-international-3712668424"
"Jefferson Frank","Full Stack JavaScript Developer","Entry level","The responsibilities Acting as a senior level developer as part of development team Developing and maintaining a reusable component library in Storybook based on atomic design principles Analysis, design and development with the above mentioned technologies Effort estimation for own tasks Maintain high standards of software quality within the team Make projects research and expand the know-how of the team Communication with other team members and customer in English Reporting of the activities performedRequirements Experience in web development with React and JavaScript/TypeScript,and implementing microservices using REST APIs Senior: Familiar with React, NodeJS and TypeScript, at least 4 years of working experience with these technologies Experience with design systems, Storybook are considered as plus Experience in designing microservices and REST APIs with OpenAPI specification is considered a plus Experience in working and designing with databases such as Postgres and DynamoDB is considered a plus Experience of developing in AWS environment, preferable cloud native development. Understanding of Lambda-functions Fluent English and Finnish skills (both written and verbal) Proficient in developing high-quality code Team player and able to closely collaborate with colleagues Basic knowledge and experience in using agile working methods BSc or MSc degrees in computer science or engineering is a plusMy client is looking to begin the interview process immediately so feel free to apply now!This is a brief description of the role, for the full information, simply apply to the role and I will call you to discuss.Twitter: @_JeffersonFrankLinkedIn: https://www.linkedin.com/in/jason-upton-167479231/Email: j.upton@jeffersonfrank.comPhone: +358 75 3266673Please Note: This is a permanent role. This role is for Finnish residents only. This role does not offer Sponsorship. You must have the right to work in Finland with no restrictions. Some of our roles may be subject to successful background/security checks.If this wasn't exactly the role you were looking for, please apply to this role anyway, just highlight what you are looking for, apply with your CV with a brief overview of what you are looking for (The role, top 3 techs, location, salary).I will call you to discuss your skill-set further, there may be other roles I am working on that you may be suited for.I specialise in Mobile, Web and Cloud (AWS) recruitment here at Jefferson Frank International, focusing on the placement of highly-skilled candidates in various IT positions (Engineers, Analysts, Architects, Consultants, Project Managers, Management etc.).We are the only global recruitment agency dedicated solely to AWS technology. Jefferson Frank is the AWS recruitment agency of choice. Whether it's a contract, permanent or remote position, we find great people great jobs.","https://fi.linkedin.com/jobs/view/full-stack-javascript-developer-at-jefferson-frank-3671477181"
"Jefferson Frank","QA Engineer/Developer - Espoo - Hybrid","Entry level","Must be in Finland.Job DescriptionEurope's leading power market, delivers efficient, simple and secure trading across Europe. The company itself is becoming fully Azure orientated and if you are into developing your skills this place can give you the tools for it. The company offers day-ahead and intraday trading, clearing and settlement to customers regardless of size or location.Role & Responsibilities Testing software for the clients development teams. Finding a way to break it and fix it. Spring Demo'sSkills & Qualifications JavaScript for Test Automation Bamboo, Jenkins, Skits Comfortable to run Sprint DemosBenefits Sport Vouchers Company HealthCare & more;This is a brief description of the role, for the full information, simply apply to the role and I will call you to discuss.Twitter: @_JeffersonFrankLinkedIn: https://www.linkedin.com/in/rokas-brancevicius-334697195/Email: r.brancevicius@jeffersonfrank.comPhone: +358 75 3263950Please Note: This is a permanent role. This role is for Finnish residents only. This role does not offer Sponsorship. You must have the right to work in Finland with no restrictions. Some of our roles may be subject to successful background/security checks.If this wasn't exactly the role you were looking for, please apply to this role anyway, just highlight what you are looking for, apply with your CV with a brief overview of what you are looking for (The role, top 3 techs, location, salary).I will call you to discuss your skill-set further, there may be other roles I am working on that you may be suited for.","https://fi.linkedin.com/jobs/view/qa-engineer-developer-espoo-hybrid-at-jefferson-frank-3671478108"
