"company","job-title","level","description","job-url"
"Canonical","Junior Graphics Kernel Engineer - Ubuntu Linux","Entry level","Are you passionate about learning new stuff, maybe graphics drivers in the context of the Linux kernel? Or maybe you've mastered a different software development environment and are ready for a new challenge in Linux? Are you looking to work on a great team, where you can apply and grow your knowledge about debian packaging as well as graphics drivers? In this role you will play an integral part in the delivery of Nvidia graphics drivers for our kernels.The Canonical Linux Kernel Team is responsible for developing and maintaining all supported Ubuntu Linux kernels, which run on a variety of platforms and architectures from small embedded devices to standard desktop/server systems to large scale cloud environments. Ubuntu boasts first class support for Nvidia graphics cards, thanks to its constant and prompt delivery of driver updates on all its platforms.For this position we are seeking a candidate that is a recent University graduate or a young professional who is enthusiastic to develop software in multiple areas including security updates, patching, and testing. This person must have a background in software engineering, be motivated to work in a distributed team and willing to travel globally up to 4 times a year for internal and external engineering events.Location: This is a remote role for someone based in the Europe/Middle East/Africa (EMEA) region.What your day will look likeMaintain the NVidia graphics drivers and package new releasesTake personal responsibility for the delivery of graphics driversPatch the kernel driver to work against the latest Ubuntu kernelEnhance and maintain Ubuntu's additions to the NVidia settings panelMaintain Ubuntu's tools for hardware detection and driver installationDiagnose and resolve issues reported by customers and the communityCollaborate regularly and proactively with a globally distributed teamWork closely with external silicon, cloud, or hardware manufacturer delivery teams on bleeding edge platformsWhat we are looking for in youWell-organized, self-starting and able to deliver to fixed schedulesDemonstrated ability to present oneself in a professional manner when interacting with colleagues, business partners, and the open source communityAbility to communicate effectively in English, both written and oralProgramming experience in C, with Python and Bash scriptingSolid background with gitKnowledge of the Linux kernel and kernel subsystems would be a plusDemonstrated experience with kernel patching and debugging is also highly regardedPrior experience with Ubuntu/Debian/Snap packaging would be highly regardedWhat we offer youYour base pay will depend on various factors including your geographical location, level of experience, knowledge and skills. In addition to the benefits above, certain roles are also eligible for additional benefits and rewards including annual bonuses and sales incentives based on revenue or utilisation. Our compensation philosophy is to ensure equity right across our global workforce.In addition to a competitive base pay, we provide all team members with additional benefits, which reflect our values and ideals. Please note that additional benefits may apply depending on the work location and, for more information on these, you can ask in the later stages of the recruitment process.Fully remote working environment - we've been working remotely since 2004!Personal learning and development budget of 2,000USD per annumAnnual compensation reviewRecognition rewardsAnnual holiday leaveParental LeaveEmployee Assistance ProgrammeOpportunity to travel to new locations to meet colleagues at 'sprints'Priority Pass for travel and travel upgrades for long haul company eventsAbout CanonicalCanonical is a pioneering tech firm that is at the forefront of the global move to open source. As the company that publishes Ubuntu, one of the most important open source projects and the platform for AI, IoT and the cloud, we are changing the world on a daily basis. We recruit on a global basis and set a very high standard for people joining the company. We expect excellence - in order to succeed, we need to be the best at what we do.Canonical has been a remote-first company since its inception in 2004. Work at Canonical is a step into the future, and will challenge you to think differently, work smarter, learn new skills, and raise your game. Canonical provides a unique window into the world of 21st-century digital business.Canonical is an equal opportunity employerWe are proud to foster a workplace free from discrimination. Diversity of experience, perspectives, and background create a better work environment and better products. Whatever your identity, we will give your application fair consideration.","https://fi.linkedin.com/jobs/view/junior-graphics-kernel-engineer-ubuntu-linux-at-canonical-3724888617"
"IQM Quantum Computers","Quantum Engineer, Device Design","Entry level","IQM is the European leader in superconducting quantum computers, established in Espoo, Finland. In two years, we have grown to 250+ employees and have established subsidiaries in Germany, Spain, and France. We build quantum computers for research laboratories and supercomputing centers. For industrial customers, we deliver quantum advantage through our unique application-specific co-design approach.We build world-leading quantum computers for the well-being of humankind now and for the future.(www.meetiqm.com)Are you interested in designing quantum processing units and want to contribute to the core technology of our quantum computers? We have an open position that you should take a look at!We are looking for several Quantum Engineers in Munich to support our mission of expanding the frontier of scientific and technological progress. You will be embedded in the Design Simulation Team and in constant exchange with other technical teams at IQM.What will I be doing? Depending On Your Background And Interest, The Work Can Also IncludeAs a member of our simulations team, you will design quantum processing units and contribute to the core technology of our quantum computers. This role has an emphasis on developing and integrating the tools to scale up quantum processor design. Your tasks will mainly focus on developing tools to integrate and automate the design workflow, while also significantly extending our open-source design framework KQCircuits.Quantum physics and design calculations. Electromagnetic field simulations, including finite element and lumped circuit modeling. Numerical modeling and optimization. What skills do I need?Prior experience in superconducting qubit design Excellent understanding of RF design and measurement concepts Good programming skills (we work mostly with Python) Ph.D. in physics, or equivalent level of experience in a related engineering field Knowledge of quantum physics and quantum computing The ability to make engineering tradeoffs between competing requirements.We are in this together and expect great cooperation skills and teamwork from all colleagues at IQM! Additionally, it's an advantage if you have an affinity with numerical methods and optimization and experience with electromagnetic field simulators such as Ansys HFSS, Comsol, or Sonnet.What can I expect from IQM?A great opportunity to perform world-class R&D and implement cutting edge technology Cutting-edge manufacturing and laboratory infrastructure Sufficient financial backing for ambitious projects An opportunity to work with a passionate and diverse team on an important mission A unique opportunity to make a real impact on the future of quantum Growth and progress in a creative and open start-up environment Meet our people and hear more about IQM by visiting our Youtube channel here >> We'll proceed with the interviews immediately, so please submit your application soon.At IQM, you will get to work with highly talented people with the latest technology.You will also collaborate with global scientific communities and have freedom to truly change the world. We are strongly integrated into the European quantum efforts and our international team is connected to business leaders and high-tech companies around the globe.Let’s discover the next quantum breakthroughs together!","https://fi.linkedin.com/jobs/view/quantum-engineer-device-design-at-iqm-quantum-computers-3554435448"
"Cobblestone Energy","SOFTWARE ENGINEER - Dubai, UAE","Entry level","Starting salary of 60,000 USD per annum in a zero-tax environment.Fast progression for strong performers.Job location: Dubai, UAEAbout us:Cobblestone Energy is a proprietary trading firm that specializes in the wholesale electricity market across Europe. Electricity is fundamental to the world's economic activities. We trade enough electricity every day to power a small country, and in doing so, we help to address the mismatch between electricity generation and consumption.Job Description At Cobblestone Energy we are on a mission to build the most advanced European electricity trading and analytics platform, with our technology being used by our teams of commercial traders to create significant value. We are looking for enthusiastic and resourceful developers who are passionate about building exceptionally reliable and performance data processing solutions. You want to help the commercial team make data-informed decisions, have a curious mindset, and are motivated to understand our business better. Developing a strong domain knowledge of our industry over time is key to long term success in this role. If you have excellent programming skills, strong problem-solving skills, and a passion for developing and improving applications utilizing cutting edge technologies, then we would like to meet you. What we offer in this role Competitive remuneration, with fast progression for strong performers. A challenging but exciting, open, and fun work environment. An opportunity to work with remarkably talented colleagues. Vast growth potential in every aspect. 15% target bonus with further upside. Employee share scheme participation International relocation support Opportunity to be embedded within a commercial team for those with strong commercial interest Responsibilities Write software applications and programs for backend/frontend purposes.  Analyse programs and apps to improve their features and functionalities.  Test & debug programs and fix any reported bugs.  Collaborate with the tech team to improve the performance, efficiency, and scalability of our tools.  Requirements BS/BE in Computer Science/Computer Engineering.  Programming experience of 1 to 2 years in Python language.  Expertise in at least one popular Python framework (like Django, Flask ...).  Experience of 1 to 2 years in front-end technologies such as HTML5, CSS, JQuery, JS, ...etc.  Knowledge of APIs and webservices.  Knowledge of Relational Databases (MySQL, PostgreSQL, SQL Server ...) and SQL language.  Knowledge of NoSQL databases is a plus.  Knowledge of AWS is a plus / Knowledge of data visualization tools, mainly Tableau, is a plus.  Ability to work in a team environment.  Strong problem-solving skills and analytical skills.  Resilience and a determination to succeed.  Independent thinkers with growth mindset.  Must be passionate, self-motivated, and able to learn quickly.  Strong sense of integrity.   Personal values that match our company values.","https://fi.linkedin.com/jobs/view/software-engineer-dubai-uae-at-cobblestone-energy-3732863842"
"Enkora Oy","Backend Software Developer","Entry level","We are looking for a passionate software developer to join the Enkora team. You will create awesome products and features used by tens of thousands of people on a daily basis. If you enjoy independence, creativity and a lot of responsibility, this could be your dream job!Enkora is the leading provider of modern customer service solutions in Finland. Our software and hardware products help our customers to sell their services, accept payments, control access, manage reservations of resources, and self-service for end-users. Every year, over 10 million customer visits are managed by our systems all around Finland. We build web-based, desktop, mobile and embedded software, design hardware and we even do some electronics!Just as we don't stop innovating with our products, we also have modern approach with development: the development environment has been well containerized, automated tests are running at every commit: unit tests, integration tests and static code analysis.Minimum Requirementsadvanced experience in PHP developmentadvanced experience in SQL queries (we're using MySQL)enjoy improving / refactoring legacy code in addition to writing newNot required, but nice to havecontinuous integration / automated testing experiencenot afraid of frontend: js/ts, html cssWe offer a full-time job in Kalasatama, Helsinki (right next to the metro!)Team of awesome international colleaguesPossibility to grow and learn new thingsFreedom to plan your workSmall team, your work will have a big impact on the final productCompetitive salary and benefitsPlease provide examples of your projects and code, and your salary expectations. Also send in links to your profiles on LinkedIn, StackOverflow, GitHub, etc.Any questions? Contact Artem (CTO) at artem[at]enkora.fi, 0407606484 or through Facebook / LinkedIn (in English).","https://fi.linkedin.com/jobs/view/backend-software-developer-at-enkora-oy-3312508519"
"iHeadHunt","Web Developer, Backend Developer  & Test Automation Engineer roles, Finland","Entry level","On behalf of our client in Finland, who has many ongoing - and starting projects in several cities, we are looking to find the right talent to following fulltime roles : Web Developer, Test Automation Engineer, and Backend Developer.Your future colleagues are waiting you to join our international team.We are working in the really modern and comfortable offices aroundFinland (The position can be in Helsinki,Tampere, Oulu or in Turku).Working with us is uncomplicated and easy due to our goodteam spirit, low-hierarchy and nonexistent bureaucracy. Our way ofworking is flexible, and you are allowed to work also remotely as longas you are able to visit our office time to time when needed. We hopeyou are able to start as soon as possible, but we are ready tonegotiate it.Available positions: Web DeveloperLocation: Tampere, Helsinki, Turku & OuluLanguage skills: Finnish requiredRequirements:React, Node, Java, C#min. 5 + years of experience Test Automation SpecialistLocation: Tampere, Helsinki, Turku & Oulu.Language: English okRequirements:5 years or more work experience in quality assurance and one or more testing software Solid skills with multiple test automation related frameworks/tools/libraries (such as Robot Framework, Jenkins, Selenium, Jira, JUnit, Docker etc.) Ability to script with at least one programming language Experience in agile environment (e.g. DevOps, Scrum) Work experience of testing embedded devices and/or web services Understanding of various test processes, types and methodsBackend DeveloperLocation: Tampere, Helsinki, Turku & Oulu.Language skills: English okRequirements: React, Python, REST, PostgreSQLNice to have - skills:Material UI, FastAPI, Kafkamin. 5 + years of experience About the company:A modern software company that develops state-of-the-art technology solutions for the automotive, telecommunications and industry sectors. Creating success by rewriting the Finnish software development success story in a completely new way. The operations revolve around people to support well-being and development – not forgetting exceptional results to our customers.Interested? Recruitment is handled by iHeadHunt and you can contact Marle Kettunen on +358 503361636 or mk@iheadhunt.dk if you want to know more about the role. Applications are continuously assessed, so please apply as fast as possible!","https://fi.linkedin.com/jobs/view/web-developer-backend-developer-test-automation-engineer-roles-finland-at-iheadhunt-3664559683"
"Huld","Embedded Software Engineer","Employment type
        

          Full-time","Are you passionate about software development and embedded systems? Are you a quick learner well suited for an international work environment? Are you a junior looking for a place to develop your skills or an established professional looking for the next step in your career?We are looking for driven, self-guided embedded software experts at different stages of their careers to join our team. We offer you the freedom to create a career that looks like yourself and responsibilities to match your ambitions. The sky is the limit (literally)!Who we areWe are a technology and design house full of independent thinkers and keen learners with humane hearts and bold attitudes. We are from different educational backgrounds and ethnic groups coming in all ages, shapes, and sizes. What unites us is our passion to pave way for a more humane and bold tomorrow for both people and our planet – with a twinkle in our eye.Embedded Solutions Center of Excellence is home for more than 100 embedded software experts. We support our customers in designing and developing embedded solutions starting from electronics design, bare metal software, device drivers, control software to spacecraft software and data processing. Our strength is safety critical software development. Our customers come from various industries, e.g., space, medical, automation, railway, machinery, measurement equipment, GNSS, networks, telecommunications, power solutions.We are looking for an Embedded Software EngineerWe are looking for an Embedded Software Engineer to better respond to our growing customer project portfolio. In this role you will work on a project that best suits your background and interests. Depending on your seniority level and project, the daily tasks may vary, but typically include software design, software development using C/C++/C#, continuous integration using DevOps tools, preparing relevant documentation, supporting your colleagues, customers and our sales team.What should you expect to accomplish the first year?Your goal during the first year is to find your feet in our group, become a trusted member of project teams and solidify your expertise in the area. You will take part in our projects and offer your know-how in building and defining sustainable solutions for our clients.As you start you will be welcomed by your Huld leader and introduced to warm office atmosphere and colleagues. You will join a project team. Your Project Manager will introduce you to the project, your responsibilities, tasks and expectations. You will be assigned a Mentor who will help you to ramp up your project work efficiently and support you until you become an independent contributor. Your success is measured by collecting feedback from your colleagues, customers and yourself and by your own satisfaction.There is no path set in a stone at Huld and we invite you to lay out your own!Here’s the recipe for successPrerequisitesB.Sc., M.Sc. or Ph.D. degree in a suitable area, e.g., computer science, automation, mathematics, physics or electronics.Understanding of embedded systems supported by 3-10 years of work experience in embedded software development and/or testing.Good skills in C/C++. We especially appreciate experience with modern C++.Good communication skills and ambitious attitude.Nice-to-havesExperience with Java, C#, Matlab, Python, Qt, Robot Framework, DevOps, scripting languages.Experience with Embedded Linux or other operating systems for embedded devices.Experience in any of the following areas is an advantage: GNSS, autonomous systems, IoT, safety critical software, algorithm development, scientific computing, data science, functional safety.Experience with Agile methodologies.Fluent English, preferably also Finnish.We promise youWe promise you a culture that is courageous and caring. Everyone has a genuine and equal chance to make a change and have an impact on how they work, whether it is by choosing to work remotely or developing company-wide ways-of-working. We are proud of what we have achieved but are always ready to learn and try something new.We promise you a low hierarchy and playful community. We promise you versatile projects where you can work on anything ranging from space to health industry, marine to machines or all the way to national security.We promise to take care of your well-being with work benefits such as:Train the brain. We have a yearly budget for you to keep on learning about topics of your choice.Joint recreational events and celebrations. We have so much to celebrate, and we like to do it together.Theme clubs. We all have our passions. In clubs such as board game club, beer club or rocket club, we get to share our interests with others.Extensive occupational health care. To keep us healthy, we have Terveystalo services at our disposal.Personal well-being budget. We have a yearly budget for all your lunch, recreation, culture, dental, massage and commuting needs in ePassi.Bicycle benefit. Cycling is great.Leisure time insurance. Accidents happen.Phone benefit. Because who can live without a phone these days.Childcare for sick children. We offer free childcare for the inevitable days your kid gets sick.Relocation support when moving to Finland. We take everyone in with open arms and support your relocation from abroad.Sounds good?Don’t wait – apply today! We will contact you as soon as possible. The recruiting process typically includes 2 interviews and an assignment between the interviews, taking 2-4 weeks in total. We are constantly looking for new talents to join us.ContactIf you have any questions or would like to talk more, please shoot us a message or have a call.Dr Tatjana PetkovicHead of Operations+358 50 486 9137tatjana.petkovic@huld.io","https://fi.linkedin.com/jobs/view/embedded-software-engineer-at-huld-3733376574"
"Canonical","Software Engineer - Ubuntu Core","Entry level","Redefine the Linux experience in the embedded environments with the smallest, most secure, and updatable operating system in the IoT market. This is an opportunity for a senior software engineer passionate about open source software, Linux, security, and the developer experience. This challenging role demands a high degree of technical skill with low-level operating systems, kernel, and device firmware.Our mission is to allow everyone to build robust solutions in various fields including but not limited to IoT, automotive, and aviation using the next generation secure embedded Linux operating system in a simple solution. We define a reliable and secure set of device recovery mechanisms that enable device manufacturers to simplify and standardise the field operations for fleets of heterogeneous appliances.As a senior team member, you'll be designing and implementing software that runs on various CPU architectures, such as ARM, RISC-V, and X86. You will work on boot mechanisms, bootloaders, storage partition layout, device trees, kernel, services, and userspace applications to manage the system via RESTful APIs.Build a rewarding, meaningful career working with the best and brightest people in technology at Canonical, a growing international software company.What you'll doDevelop system daemons with REST APIs in GolangIntegrate diverse bootloaders and maintain gadget snapsCollaborate proactively with a distributed teamWrite high quality code with unit tests to create new featuresDebug issues and produce high quality fixesReview code produced by other engineersDiscuss ideas and collaborate on finding good solutionsWork from home with global travel 2 to 4 times a year for internal and external eventsWho you areYou love technology and working with brilliant peopleYou are curious, flexible, articulate, and accountableYou value soft skills and are passionate, enterprising, thoughtful, and self-motivatedYou have a Bachelor's or equivalent in Computer Science, STEM or similar degreeYou have experience with Golang, C/C++, and ShellYou have a solid understanding of Linux and a modern GNU/Linux distribution, Debian or Ubuntu preferredYou have experience or interest in low-level system and security facilities such as:Bootloaders in ARM and X86, such as piboot, uboot, grub-uefiSystemd and units, udev, initrd, graphicsOS level firmware daemons and CLI applicationsLinux security implementations - TPM, FDE, LUKS, HSM, etc. You have experience with API design and development - REST/gRPC or similarYou have personal or professional experience with Linux-capable devices such as Raspberry PiWhat is Canonical?Canonical is a growing international software company that works with the open-source community to deliver Ubuntu, ""the world's best free software platform"". Our services help businesses worldwide to reduce costs, improve efficiency and enhance security with Ubuntu.We are proud to foster a workplace free from discrimination. Diversity of experience, perspectives, and background create a better work environment and better products. Whatever your identity, we will give your application fair consideration.#stack","https://fi.linkedin.com/jobs/view/software-engineer-ubuntu-core-at-canonical-3673080309"
