"company","job-title","level","description","job-url"
"Canonical","Product Marketing Manager IoT","Entry level","Canonical is looking for a Product Marketing Manager IoT who will be responsible for developing marketing strategy and go to market plans at a global level for Canonical's IoT portfolio. This is a hands-on, multi-disciplinary and dynamic position, requiring close collaboration with the Product and engineering teams, content team, Sales Teams, as well as other Marketing functions.The ideal candidate is passionate about technology, technology marketing and the use of technology in marketing. They prefer to work in an environment that emphasises ownership of campaigns, collaboration, learning, curiosity and a drive to continually improve oneself / the team / the organisation. They love to problem solve, get hands-on, experiment, measure and use automation to make daily life easier.Location: This role will be based remotely in the EMEA region.What Your Day Will Look LikeBe responsible for go-to-market planning and execution for Canonical's range of IoT productsLead on content dissemination planning, campaign development and planning for planning product launches. You will lead on the development of compelling messaging and positioning that emphasizes business value and connects with target audiences throughout the buying journeyConceiving and executing customer base communications and marketing programs to upsell and cross sell into our large base of customersCollaborating with demand generation teams, utilizing data and insights to create and improve strategies that drive traffic to our content, optimizing marketing funnelsWork with other teams to plan event, webinars and support paid and social media promotionCreate and publish content (online and print) in line with marketing plans to deliver on campaignsMonitoring the competitive landscape to define product positioning that differentiatesWhat We Are Looking For In YouPassion for IoT and some exposure to the embedded spaceAbility to think strategically about complex issues, leading to thoughtful recommendations, and action plansExceptional interpersonal skills, and aptitude for forging trusting relationships across diverse, cross-functional teamsConversant in go-to-market strategies and methodologiesSkilled in leading presentations and discussions with industry analysts, business, technical, and sales stakeholdersExcellent verbal and written communication skills, strong content marketerProven ability to prioritize and differentiate what matters from the noise, meeting deadlines without sacrificing qualityGrowth mindset - someone who is not afraid to think big and take on risk. What We Offer YouYour base pay will depend on various factors including your geographical location, level of experience, knowledge and skills. In addition to the benefits above, certain roles are also eligible for additional benefits and rewards including annual bonuses and sales incentives based on revenue or utilisation. Our compensation philosophy is to ensure equity right across our global workforce.In addition to a competitive base pay, we provide all team members with additional benefits, which reflect our values and ideals. Please note that additional benefits may apply depending on the work location and, for more information on these, please ask your Talent Partner.Fully remote working environment - we've been working remotely since 2004!Personal learning and development budget of 2,000USD per annumAnnual compensation reviewRecognition rewardsAnnual holiday leaveParental LeaveEmployee Assistance ProgrammeOpportunity to travel to new locations to meet colleagues at 'sprints'Priority Pass for travel and travel upgrades for long haul company eventsAbout CanonicalCanonical is a pioneering tech firm that is at the forefront of the global move to open source. As the company that publishes Ubuntu, one of the most important open source projects and the platform for AI, IoT and the cloud, we are changing the world on a daily basis. We recruit on a global basis and set a very high standard for people joining the company. We expect excellence - in order to succeed, we need to be the best at what we do.Canonical has been a remote-first company since its inception in 2004. Work at Canonical is a step into the future, and will challenge you to think differently, work smarter, learn new skills, and raise your game. Canonical provides a unique window into the world of 21st-century digital business.Canonical is an equal opportunity employerWe are proud to foster a workplace free from discrimination. Diversity of experience, perspectives, and background create a better work environment and better products. Whatever your identity, we will give your application fair consideration.","https://fi.linkedin.com/jobs/view/product-marketing-manager-iot-at-canonical-3704072822"
"Viva.com","Lead Generation Officer","Entry level","Are you a fluent Finnish and English speaker? Are you looking to start or continue your career within the Sales sector? Do you have good communicational skills? Are goal-driven and passionate about sales? If the answer is Yes, then you might be the next one who will join our fast-growing Sales Team! Who We Are Viva.com is a leading European cloud-based neobank, delivering the future of payments, now. With presence in 24 markets, it is the payment institution with the largest footprint in Europe. Viva.com's mission is to change the way businesses pay and get paid, offering truly unifying, yet localized, end-to-end advanced digital payments solutions and embedded banking services tailored to their needs. An advocate for a sustainable cashless economy, the Organisation delivers digital payments services across three different time zones, in 17 languages and 9 currencies, featuring over 30 payment methods. Harnessing the power of revolutionary technologies, such as the viva.com | Terminal app and Smart Checkout payment gateway, Viva.com provides an omnichannel solution, that offers seamless, conversion-boosting and secure ways to process online and in-person transactions, streamlining business operations and enhancing the customer experience. Learn more at viva.com  What you will do Making outbound calls/conferences from inbound leads and from online tools (LinkedIn, etc.) in the respective markets.Researching potential new leads and approach potential clients.Manage and close direct leads, assist small merchants with self-registration, follow up and kick-off of these merchants.Be responsible for informing and making introduction conference and digital presentations to these potential clients about our products or services by using our scripts.Answer their questions about products or the company and resolve client's problems.Act as an ambassador for the business and promote Viva's services and products.Ask questions in order to understand customer requirements and close sales.Be proactive in identifying opportunities from new business, to share potential leads to the Business Development team and to convert the calls into appointments for them.Enter and maintain up to date client information into the company database and keep records relevant data from calls and sales.Ensure customer satisfaction.Build a long-term relationship with clients and deal with them in a professional manner.Guarantee the quality of our service in a prompt, polite and professional manner. RequirementsExcellent communication skills and excellent telephone manners.Ability to work independently and under pressure.Very good verbal and written skills.Proficient level of Finnish and English.A positive approach to objection handling.Good organizational skills and attention to detail.Proven track record of successfully meeting sales quota preferably over the phone.Good knowledge of relevant computer programs (e.g., CRM software), social networking (LinkedIn) and telephone systems. BenefitsA competitive salary (based upon your super skills and experience)An attractive sales bonus scheme up to 10 monthly salariesIndefinite contractRelevant and refresh training related to your roleOpportunity for a rapid career developmentOpportunity to work closely with a highly motivated team in a dynamic and fast paced environmentFreedom to create your own network and the possibility to expand your horizonChance to work in an international fin-tech company with a large cultural diversityChance to acquire excellent knowledge in the payment and banking industry","https://fi.linkedin.com/jobs/view/lead-generation-officer-at-viva-com-3720335128"
"Nigel Frank International","Full Stack Developer (.NET/C#, Angular) - Up to 5,000EUR","Entry level","Full Stack Developer - Permanent Hire - ConsultancyCompany information:My client is a well-established consultancy company with offices based in Helsinki, Tampere, Lahti and Turku. They specialise in delivering high-impact solutions to large enterprise customers. Their focus is on developing advanced analytics-based solutions that drive informed decision-making. With a commitment to excellence and innovation, they are at the forefront of helping our clients grasp data to its full potential!Role and Responsibilities: Working as a part of a small team made up of Software Developers, BI Consultants, Data Engineers and Lead Consultants on several projects for large enterprise customers. Participating in developing embedded web based solutions into Power BI/Qlik applications. Working closely with their enterprise clients to understand their specific needs and requirements, and translating them into robust technical solutions. Taking ownership of internal product development tasks, contributing to the evolution of their offerings. Participating in code reviews, ensuring code quality and adherence to best practices.Required experience: Finnish fluency. Minimum of 2 years of experience with the following tools: On the back-end experience with .NET/C# or PHP Angular development on the frontend (experience with other modern JavaScript frameworks is also possible). Experience with Azure Cloud and Scala is beneficial but not required. Excellent problem-solving skills and a proactive approach to tackling challenges.Reasons for applying: Opportunity to work for the customers who are working in modern environment on greenfield projects in a public cloud. Modern and young company culture! The social aspect is very important for them, aiming to create an extremely comfortable and informal atmosphere in the office. Great professional development opportunities, you can learn new technologies and skills each week during the company time. Flexible hybrid working model with 2-3 office visits per week required. Earning potential of up to 5,000EUR.Any further questions before applying?Email: e.tsvang@nigelfrank.comCall: +358942452344","https://fi.linkedin.com/jobs/view/full-stack-developer-net-c%23-angular-up-to-5-000eur-at-nigel-frank-international-3707971082"
"Mapbox","Software Development Engineer II, 3D Graphics","Entry level","Mapbox is building a live location platform. Our maps represent the ever-evolving world, accessing, aggregating, and adapting anonymous data from millions of sensors and phones in real-time. Mapbox has the exciting opportunity to power devices and products across the next frontier in location-based data. Whether you’re watching the delivery of your grocery order on Instacart, tracking your personal best mile on Strava, sending snaps on Snapchat, monitoring your gas budget on Metromile, or checking today’s forecast on The Weather Channel, Mapbox is the location and maps within those apps. We’re changing how people move by live-mapping the world.What We DoAs the 3D graphics team, we use our engineering skills and curiosity to push the boundaries of what’s possible with interactive maps and how people use location technologies in their daily lives. We work on state-of-the-art platforms, largely open-source, for map interaction and visualization used by millions of people around the globe.What You’ll DoWork on the world’s leading open source vector map rendering engines.Work on the entire graphics chain, from assisting in data processing pipeline creation to rendering.Work with a modern C++14/17 and a modern TypeScript codebase, using the best practices of software engineering and tools.Solve interesting graphics programming, algorithms, and architectural challenges.Improve the project’s performance, stability, maintainability and simplicity.Experiment with new visualization techniques and fast graphics and geometry algorithms; and see them benefit millions of people in consumer mapping applications.What We Believe Are Important Traits For This RoleCuriosity, enthusiasm, eagerness to solve challenging technical problems in the geo and data visualization space using emerging technologies.Empathy and kindness; willingness to learn from different perspectives and patience to help others grow.Strong communication skills and ability to collaborate effectively with distributed teams.Strong in C++, JS/TypeScript, algorithms and performance optimization.Strong in Graphics programming (OpenGL, Metal, Vulkan, WebGL, WebGPU).Strong in 3D Graphic techniques and being able to apply them to a wide range of platforms.Helpful experience that is a plus but not a requirementMaintaining or contributing to open source projects.Location technologies (maps, GIS).Other programming experience (JavaScript, iOS, Android).Embedded platforms (Linux embedded, Android, QNX).What We ValueIn addition to our core values, which are not unique to this position and are necessary for Mapbox leaders:We value high-performing creative individuals who dig into problems and opportunities.We believe in individuals being their whole selves at work. We commit to this through supportive health care, parental leave, flexibility for the things that come up in life, and innovating on how we think about supporting our people.We emphasize an environment of teaching and learning to equip employees with the tools needed to be successful in their function and the company.We strongly believe in the value of growing a diverse team and encourage people of all backgrounds, genders, ethnicities, abilities, and sexual orientations to apply.By applying for this position, you acknowledge that you have received the Mapbox Non-US Privacy Notice for applicants, which is linked here. Completing this application requires you to provide personal data, such as your name and contact information, which is mandatory for Mapbox to process your application. Mapbox is an EEO Employer - Minority/Female/Veteran/Disabled/Sexual Orientation/Gender Identity","https://fi.linkedin.com/jobs/view/software-development-engineer-ii-3d-graphics-at-mapbox-3655595809"
"Sanofi","North Europe Junior Marketing Manager - VIE Contract (W/M)","Entry level","iMove, the Sanofi VIE Program, is available to citizens of the European Economic Area (EU + Norway, Liechtenstein and Iceland) aged between 18 and 28.PLEASE NOTE that since this program is primarily an international development program, candidates cannot apply to a VIE assignment in their own country of citizenship.PLEASE NOTE that applications that are only submitted in French cannot be considered by our non-French speaking partners at Sanofi worldwide.Therefore, only applications that are submitted in English will be considered.At Sanofi diversity and inclusion is foundational to how we operate and is embedded in our Core Values. We respect the diversity of our people, their backgrounds and experiences. We recognize to truly tap into the richness diversity brings we must lead with inclusion and have a workplace where those differences can thrive and be leveraged to empower the lives of our employees, patients and customers.We are looking for: North Europe Junior Marketing Manager - VIE Contract (W/M)Target start date: 01/01/2024We are looking for enthusiastic and driven Junior Marketing Manager VIE to join our agile Marketing team. The Junior Marketing Manager VIE will be the go-to person when it comes to operational development of marketing material and campaigns, and a strong contributor in marketing activities in the launches of new products as well as for the existing product portfolio.Responsibilities:Supporting Marketing Head in the annual Brand Planning and developing overall brand priorities for North Europe (NE)Scheduling and managing cross-functional team meetings, capturing minutes and deliverables/follow upsEngaging in transversal teamwork and communicationOptimizing cross-functional support in the organization and across the different countries in the regionPlanning and execution of multi-channel activitiesOperational development of marketing material, promotional campaigns and digital projects with local teams and external agenciesStrictly following Global, local and Sanofi Vaccines Policies & procedures to ensure efficient and compliant local operations in line with local laws and Company Code of EthicsRequirements:Master’s Degree in Business, Marketing, or related fieldMinimum 1 year of relevant experienceExperience in pharma industry is considered a very strong plusStrong communication skills in EnglishProficient in Microsoft office applications (PowerPoint, Excel, Word)Preferably experience with photo editing- and digital design toolsTeam player with ability to engage people & collaborate transversallyA digital mindset, ability to utilize new channels in an effective and impactful wayAt Sanofi diversity and inclusion is foundational to how we operate and embedded in our Core Values. We recognize to truly tap into the richness diversity brings we must lead with inclusion and have a workplace where those differences can thrive and be leveraged to empower the lives of our colleagues, patients and customers. We respect and celebrate the diversity of our people, their backgrounds and experiences and provide equal opportunity for all.","https://fi.linkedin.com/jobs/view/north-europe-junior-marketing-manager-vie-contract-w-m-at-sanofi-3729459793"
