"company","job-title","level","description","job-url"
"Silo AI","AI Engineer - DevOps/MLOps","Entry level","At Silo AI our team of 200+ AI Engineers, AI Scientists, Solutions Architects, Software Developers, and Designers collaborate closely to tackle challenging real-world problems related to AI. Now we are looking for AI Engineers to build MLOps solutions for quality ML development and scalable AI utilizations in multi-cloud environments. The work is done as part of our Helsinki, Tampere, Turku, Jyväskylä, Oulu, Stockholm or Copenhagen teams.What Will You Be DoingBuilding versatile ML development and AI deployment setups (pipelines and/or platforms) and other MLOps solutions to enable production-level AI and ML in multi-cloud environments and sometimes in connection to IoT and embedded settingsWork very practically hand-on but also designing the needed architectures and workflows - enabled by Silo AI assets and learning from versatile project casesWork as part of the team with leading AI experts and use cutting edge tools to train, deploy and service advanced machine learning models Working in client projects in various different industries that typically lasts 3-6 months, but we also work in long-term projects lasting 1-2 years Contributing to Cloud AI & MLOps community and R&D work of Silo AIWhat We Are Looking For From YouYou have strong experience in software development Experience in training, versioning, deploying, monitoring and/or maintaining machine learning modelsYou have knowledge of cloud platforms and technologies (e.g. Kubernetes, Azure, AWS and/or Google Cloud)You are experienced in programming with Python and can adopt other programming languages. You are familiar with some typical MLOps tools, such as KubeFlow, MLFlow, KFServing/KServe, Seldon, Airflow, Argo, Prefect or others; some DevOps tooling such as Docker, Kubernetes, Terraform scripting (or CloudFormation or similar); some machine learning frameworks, such as Tensorflow and/or PyTorch; some logging tools, such as ElasticStack, Grafana, Prometheus and/or othersYou have a track record of producing quality code and developing software with different practices (CI/CD, version control, some variety of agile development)You may have also DataOps related experience around storage (SQL, NoSQL, cloud), processing (batch, stream, ETL), managing/versioning, security, visualization and/or big dataYou are interested in working and communicating with Silo AI clients and working part of the team with Silo experts Be able to learn new skills and adapt quickly, as the problems, tools, best practices, and architectures are rapidly changing. What Silo Ai Offers To YouReal-world and production-level projects related to AI in various different industries such as retail, manufacturing, machine industry, automotive, pharma, telecom, smart devices, medical, energy & infra, logistics, healthcare, and internet services High-level & diverse tech and non-tech expertise around you as peers with our team of 200+ employees and 20+ nationalities Cloud AI & MLOps community which includes 30+ experts and a lot of information sharing and learning resources - and our other three technology areas include IoT, Embedded and Connectivity which bring their own additions to the MLOps work Learning culture with several different learning activities to support your learning such as 1-1 talent coaching with lead level experts, self-development benefit, company-wide workshops, internal research club bi-weekly basis Silo social activities like daily meditation, virtual lunches, and company-wide all-hands every Friday, company supported Silo social activities Growth company environment - in 2021 we have hired around 100 new employees and opened up a new office in Copenhagen, Denmark. In 2022 we are looking for hiring even more employees than in 2021 and opening up new countries in addition to the three current ones. Possibility to become Silo shareholderNormal benefits such as work equipment of own choice, occupational healthcare, sports & culture vouchers, internet, lunch through Wolt on Fridays, self-development budgetOUR CULTUREWhat we believe in at SiloBuild bonds - Trust is our bond. We connect with customers and seek to understand how we can best help, and always keep what we promise. We encourage a culture in which successes are celebrated, learnings shared and support provided for our team members to succeed. Be good - Positive impact. We strive to be transparent and open, take responsibility and ownership, and aim for positive impact and results in all we do. We take pride in creating an equal and supportive workplace for talented and ambitious professionals from all nationalities, genders, and backgrounds. Ask why - Know your why. We have the courage and agility to keep challenging what we're doing to assure value creation for customers. We encourage open dialogue and debate and strive for diversity in opinions to improve decision making. Keep learning - Grow to excel. We aim for excellence by learning from the market, sharing our competence, and recruiting a growth mindset. For us expertise is not an achievement, it's a lifestyle of curiosity, learning, sharing, and working with people who share the same hunger. WANT TO KNOW MORE?You can ask more about Silo AI as a workplace from our Talent Acquisition Lead Emmi Matvejeff, emmi.matvejeff@silo.ai","https://fi.linkedin.com/jobs/view/ai-engineer-devops-mlops-at-silo-ai-3673080616"
"Canonical","Embedded Linux Containers Software Engineer","Entry level","Work on mission-critical Golang code, focused on software delivery, containers, security sandboxing, telemetry and device management, as a software engineer on our SnapD team.Snaps are next-generation software packaging and delivery for Linux. They are designed for safety, security and robustness, with application-specific confinement of containers optimised for IoT devices, desktops and servers. Our goal is that snaps work across multiple Linux flavors to ensure that publishers have the simplest way to reach the whole Linux world.This role requires an obsession with quality and performance, for work at the heart of the operating system. It also requires an interest in the software publishing and consumption experience. Applicants should be passionate about open source software development. We value collaboration, peer reviews, good unit/integration testing and maintainable code. General knowledge and experience with Golang and Linux as a developer platform is required.What you'll doCollaborate proactively with a distributed teamWrite high quality code to create new featuresDebug issues and produce high quality code to fix themReview code produced by other engineersDiscuss ideas and collaborate on finding good solutionsObsess over how to achieve robustness despite unexpected events like power outagesWork from home with global travel for up to two weeks, twice a yearWho you areYou love technology and working with brilliant peopleYou are curious, flexible, articulate, and accountableYou value soft skills, are thoughtful and self-motivatedYou have a Bachelor's or equivalent in Computer Science, STEM or similar degreeYou have professional software development experience using Go, Python, C, or C++You know Linux system-level fundamentals, e.g. cgroups, namespaces, apparmorCommitment to software testing, code reviews and maintainable codeAbout CanonicalCanonical is a growing, international software company that works with the open-source community to deliver Ubuntu. Our services help businesses worldwide to reduce costs, improve efficiency and enhance security with Ubuntu. Canonical is a unique tech company - global, remote-first, open source, with 700 professionals across 50 countries - we want to be the world's best, not biggest, global software company. With almost every team remote by default, Canonical sets the pace on the 21st-century digital workplace.Work from homeLearning and development allowancesCompetitive SalaryAnnual compensation reviewRecognition rewardsGenerous annual leavePaid maternity, paternity and sick leavePriority Pass for travelExposure to international business and technologyWe are proud to foster a workplace free from discrimination. Diversity of experience, perspectives, and background create a better work environment and better products. Whatever your identity, we will give your application fair consideration.","https://fi.linkedin.com/jobs/view/embedded-linux-containers-software-engineer-at-canonical-3673074917"
"Target Vision Oy - Executive Search & Recruitment Tailor Made Solutions in Finland and International","Communication Associate","Entry level","Our client is a growing System Engineering and Solution Company, which offers services like Semiconductor Engineering R&D Services, Embedded Systems Development, Custom Application Software Development, Web and Cloud Application Development, Testing Services, Consultancy and Outsourcing services across the globe for an onsite and offshore business model. Company has presence in Sweden, Finland, Poland, Czech Republic and in India. They are now looking for a Communication Associate in Lund, Sweden to be part of their wireless team for a project, which will last for at least one year.You have the following qualifications and the experience:A Master’s degree in Electrical Engineering / Communications Systems or similar education.At least 10 years of experience in the wireless communication industry as a researcher or as a technical leader.Knowledge of the 3GPP functionality, physical layer aspects and experience of innovation and IPR.Up-to-date knowledge about the new research trends and an extensive academic network within the EU is a plus.A track record of successful and positive leadership.The following skills/personal characteristics are also required:A role model that can develop, empower and encourage team members.Communicate fluently in English, both verbally and in writing.","https://fi.linkedin.com/jobs/view/communication-associate-at-target-vision-oy-executive-search-recruitment-tailor-made-solutions-in-finland-and-international-3664542004"
"FRG Technology Consulting","DevOps Engineer - Product House - Helsinki","Entry level","Qualities That We Are Looking ForA person that is able to carry a project from start to finish. The person should be a finisher by nature and able to work independently. The person should not be afraid to try new tools and walk on untouched ground. We are looking for a systematic person, who can bring structure and workflows to the sometimes chaotic nature of a startup. Automation is an acronym that sticks to the person.TasksAutomate deployment of Node v.18 Lambda functionsCreate dashboard in Cloudwatch to gain more insight into the use of our applicationMitigate security findings in the cloudHousekeeping and creating a healthy production environment.Elevate our CI/CD pipelines to next levelIdentify and set up quality gates that our SW should meet.Automate our deployment processCreate an awesome monitoring platform using Zabbix, where we can be at the forefront of problems.Need To HaveExperience using AWS services and IaaC.Experience using JenkinsAutomation/Monitoring tools like: Ansible, Packer, Zabbix etc.Experience developing in a Linux environmentPython and DockerNice To HaveExperience with embedded testing frameworks fx. LabgridAutomate VM creation using fx. Packer/vagrantUnit testing / integration testingReach Out To Learn MoreMy client is looking to begin the interview process ASAP with limited interview spots this and next week, so don't miss out.This is a brief description of the role, for the full information, simply apply to the role and I will call you to discuss.Twitter: @_JeffersonFrankLinkedIn: https://www.linkedin.com/in/george-heron-aa8676138/Email: g.heron@frankgroup.comPhone: +358 753 266586Book a Meeting: https://calendly.com/g-heronPlease Note: This is a permanent role. This role is for Finnish residents only. This role does not offer Sponsorship. You must have the right to work in Finland with no restrictions. Some of our roles may be subject to successful background/security checks.If this wasn't exactly the role you were looking for, please apply to this role anyway, just highlight what you are looking for, apply with your CV with a brief overview of what you are looking for (The role, top 3 techs, location, salary).I will call you to discuss your skill-set further, there may be other roles I am working on that you may be suited for.I specialise in Mobile, Web and Cloud (AWS) recruitment here at Jefferson Frank International, focusing on the placement of highly-skilled candidates in various IT positions (Engineers, Analysts, Architects, Consultants, Project Managers, Management etc.).We are the only global recruitment agency dedicated solely to AWS technology. Jefferson Frank is the AWS recruitment agency of choice. Whether it's a contract, permanent or remote position, we find great people great jobs.","https://fi.linkedin.com/jobs/view/devops-engineer-product-house-helsinki-at-frg-technology-consulting-3723943469"
"Qt Group","Solution Engineer","Entry level","In Qt, we work hard but try not to take ourselves too seriously. We are highly adaptable and constantly evolving. We are passionate about our products and solutions, and we live for our customers. We have high expectations and a career at Qt means challenging yourself to always be better.The sales activity for our main product Qt and associated Consulting Services is growing fast in our major territories and The Qt Company has a solid customer base, containing a large number of internationally well-branded companies. Our customers use our tools for highly valued developments of applications in different areas such as EDA, Medical, consulting, Telecommunications, and Automotive, among others. The EMEA market is among the most important regions for Qt and provides an excellent opportunity for a skilled and experienced sales professional to take responsibility for developing the Qt business in markets with strong potential. The Sales Engineer is responsible for pre-sales technical assistance for the regional sales teams and will perform technical presentations & demonstrations of the Qt product line, in addition, be involved in all aspects of the technical sales.ResponsibilitiesDirectly responsible for teaming with the sales team through all aspects of the sales cycle.Understand technical customer requirements and find solutions together with Product Management / R&D.Provide strategic and senior-level product presentations, demonstrations, and trade show support.Follow up on prospects and accounts for functional/technical issues related to the sales cycle and guarantee a successful customer experience.Manage product evaluations and prepare RFP/RFI responses.Coordinate the technical training of the sales teams.Identify the need for additional sales, training, and consulting.ExperienceTechnical knowledge and understanding of the development processes5+ years of experience in technical selling, embedded technology, or similarSolid understanding and experience with C/C++ and preferably other object-oriented languagesQt knowledge is a clear advantage.Knowledge of a low-level software stackExcellent presentation, demonstration, and facilitation skills in leading meetings, trials, and projectsExperience with the creation, customization, and delivery of presentationsFluent verbal and written communication in EnglishBachelor’s degree in computer science/ technology or equivalent related experienceSkillsAutonomous and organized with effective communication skills, listening, verbal, and written.Must take initiative and be a proactive member of the sales team.Team player with interpersonal skills to work with sales and technical staff in a dynamic and innovative company environment.Very good business understanding.Willing and able to travel 20% within EMEAThe role is based in one of our offices in Europe; Espoo, Finland; Oslo, Norway; Paris, France or Munich/Berlin/Hamburg, Germany.What We OfferAt Qt, you get to work with a truly global team in an innovative and fun environment and with world-leading customers and a large, unique community. We have a cool product, but it is our people that make us exceptionalEasy-going atmosphere with talented and great colleagues from many parts of the worldChances to learn new every dayNice office space and ergonomic equipmentFull support for your mental health at work and at home via Auntie Program Flexible and remote-friendly policy Language learning platform Diverse teams from different cultures promote creativity and inclusivity. Mobile Phone Plus local benefitsAbout QtQt Group (Nasdaq Helsinki: QTCOM) is a global software company, trusted by industry leaders and over 1.5 million developers worldwide to create applications and smart devices that users love. We help our customers to increase productivity through the entire product development lifecycle - from UI design and software development to quality management and deployment.Our customers are in more than 70 different industries in over 180 countries. Qt Group is headquartered in Espoo, Finland, and employs almost 700 people globally. To learn more, visit www.qt.ioBe yourself at QtAt Qt, we appreciate the individual differences of our employees and aim to promote diversity through all our practices. We provide a workplace that generates equal opportunities regardless of gender, religion, national origin, age, disabilities, and any other factors. We have unique products, but our people make us exceptional. We strongly encourage people from all groups to apply – we welcome you as you are.","https://fi.linkedin.com/jobs/view/solution-engineer-at-qt-group-3648701875"
"Nigel Frank International","Azure IoT Developer","Entry level","Azure IoT Developer - HelsinkiOur Client is looking for talented developers to join their team as they are growing! They have won awards for both business growth and for their exciting R&D focus in 2023-2024.Company: Founded in Finland with a global clientele. They have around 50 employees in Finland and 50 employees globally so far. Big aspirations with further growth planned in 2024. Products offer a range of benefits such as providing customers with more efficient ways of working, lowering costs and providing solutions that reduce energy consumption. Continuing to invest in modern technologies such as AI and Machine Learning.Project information Focusing on improving the collection of Data from a range of their IoT devices and products. Helping customers to remotely view their data, make fixes, change parameters. Long-term focus for this project, but able to be involved as a ""secondary"" person for other internal projects.Experience and requirements: Previous C#, .NET and React development experience Fluency in English. A background with Azure or Cloud development projects. Previous work experience or strong interest/understanding of IoT. Senior-level working experience.Viewed as beneficial: Previous experience with any projects involving embedded development, Cloud Infrastructure, the energy industry, PLC or others. Bachelor's or Master's Degree. Fluency in Finnish.What can they offer YOU? Exciting and modern tech stack to work with. Award winning focus on R&D. Benefits including: Health-care, lunch and culture vouchers and more. Basic salary range (expected): 4500-6000€ per month & company bonus scheme on top. Extremely flexible remote work - 2/3 office visits per year is fine, more visits to the office is fine but your choice.Does this sound interesting? Send your application today or message me for more information on j.selen@nigelfrank.com.Nigel Frank International is the global leader for .NET recruitment, advertising more .NET jobs than any other agency. We deal with both Microsoft Partners & End Users throughout Finland. By specialising solely in placing candidates in the .NET market I have built relationships with most of the key employers in Finland and have an unrivalled understanding of where the best opportunities and .NET jobs are.","https://fi.linkedin.com/jobs/view/azure-iot-developer-at-nigel-frank-international-3662009501"
"Nigel Frank International","Azure IoT Developer","Entry level","Azure IoT Developer - HelsinkiOur Client is looking for talented developers to join their team as they are growing! They have won awards for both business growth and for their exciting R&D focus in 2023-2024.Company: Founded in Finland with a global clientele. They have around 50 employees in Finland and 50 employees globally so far. Big aspirations with further growth planned in 2024. Products offer a range of benefits such as providing customers with more efficient ways of working, lowering costs and providing solutions that reduce energy consumption. Continuing to invest in modern technologies such as AI and Machine Learning.Project information Focusing on improving the collection of Data from a range of their IoT devices and products. Helping customers to remotely view their data, make fixes, change parameters. Long-term focus for this project, but able to be involved as a ""secondary"" person for other internal projects.Experience and requirements: Previous C#, .NET and React development experience Fluency in English. A background with Azure or Cloud development projects. Previous work experience or strong interest/understanding of IoT. Senior-level working experience.Viewed as beneficial: Previous experience with any projects involving embedded development, Cloud Infrastructure, the energy industry, PLC or others. Bachelor's or Master's Degree. Fluency in Finnish.What can they offer YOU? Exciting and modern tech stack to work with. Award winning focus on R&D. Benefits including: Health-care, lunch and culture vouchers and more. Basic salary range (expected): 4500-6000€ per month & company bonus scheme on top. Extremely flexible remote work - 2/3 office visits per year is fine, more visits to the office is fine but your choice.Does this sound interesting? Send your application today or message me for more information on j.selen@nigelfrank.com.Nigel Frank International is the global leader for .NET recruitment, advertising more .NET jobs than any other agency. We deal with both Microsoft Partners & End Users throughout Finland. By specialising solely in placing candidates in the .NET market I have built relationships with most of the key employers in Finland and have an unrivalled understanding of where the best opportunities and .NET jobs are.","https://fi.linkedin.com/jobs/view/azure-iot-developer-at-nigel-frank-international-3709931064"
